name,datetime,tempmax,tempmin,temp,feelslikemax,feelslikemin,feelslike,dew,humidity,precip,precipprob,precipcover,preciptype,snow,snowdepth,windgust,windspeed,winddir,sealevelpressure,cloudcover,visibility,solarradiation,solarenergy,uvindex,severerisk,sunrise,sunset,moonphase,conditions,description,icon,stations
kuala lumpur,1/1/2019,33.9,24.4,27.8,41.6,24.4,30.4,24,81.3,18.611,100,12.5,rain,,,,19.6,317.3,1012.2,70.6,9.3,187.7,16.2,7,,2019-01-01T07:18:16,2019-01-01T19:14:48,0.83,"Rain, Partially cloudy",Partly cloudy throughout the day with rain.,rain,"48647099999,48650099999,WMSA,WMKK"
kuala lumpur,1/2/2019,32.9,23.9,27.5,39.1,23.9,30.5,23.9,81.9,6.188,100,4.17,rain,,,,17.7,307.5,1011.9,58.1,9.3,203.6,17.7,8,,2019-01-02T07:18:43,2019-01-02T19:15:18,0.86,"Rain, Partially cloudy",Partly cloudy throughout the day with early morning rain.,rain,"48647099999,48650099999,WMSA,WMKK"
kuala lumpur,1/3/2019,32.7,25.2,28.4,38.7,25.2,31.3,23.7,76.5,0,0,0,,,,46.4,30.8,313.6,1011.3,58.8,10,187.3,16.3,7,,2019-01-03T07:19:10,2019-01-03T19:15:47,0.9,Partially cloudy,Partly cloudy throughout the day.,partly-cloudy-day,"48647099999,48650099999,WMSA,WMKK"
kuala lumpur,1/4/2019,33,24.1,28.4,39,24.1,31.5,23.3,75.2,0,0,0,,,,,23.5,312.7,1011.9,59.2,10.1,217,18.8,7,,2019-01-04T07:19:36,2019-01-04T19:16:16,0.93,Partially cloudy,Partly cloudy throughout the day.,partly-cloudy-day,"48647099999,48650099999,WMSA,WMKK"
kuala lumpur,1/5/2019,33.8,24.1,28.7,40.3,24.1,32,23.6,75.5,0,0,0,,,,,13,301.5,1011.3,58.2,9.8,258.4,22.3,9,,2019-01-05T07:20:01,2019-01-05T19:16:44,0.97,Partially cloudy,Partly cloudy throughout the day.,partly-cloudy-day,"48647099999,48650099999,WMSA,WMKK"
kuala lumpur,1/6/2019,34.7,24.6,28.9,42.4,24.6,33,24.7,79.4,0,0,0,,,,,12.3,321.2,1010.7,58.4,9.2,230.9,19.9,8,,2019-01-06T07:20:26,2019-01-06T19:17:13,0,Partially cloudy,Partly cloudy throughout the day.,partly-cloudy-day,"48647099999,48650099999,WMSA,WMKK"
kuala lumpur,1/7/2019,34.9,24.3,28.8,41.6,24.3,32.4,24.1,77.3,22.101,100,4.17,rain,,,,16.8,49.9,1010.5,57.7,9,212.8,18.4,7,,2019-01-07T07:20:51,2019-01-07T19:17:41,0.04,"Rain, Partially cloudy",Partly cloudy throughout the day with early morning rain.,rain,"48647099999,48650099999,WMSA,WMKK"
kuala lumpur,1/8/2019,34.1,25.1,28.3,41.6,25.1,31.7,24.4,80.7,6.768,100,4.17,rain,,,,13,77.9,1010.8,58.2,8.9,159.9,13.8,6,,2019-01-08T07:21:15,2019-01-08T19:18:08,0.07,"Rain, Partially cloudy",Partly cloudy throughout the day with late afternoon rain.,rain,"48647099999,48650099999,WMSA,WMKK"
kuala lumpur,1/9/2019,34,26,28.6,40.6,26,31.6,24.5,80.2,3.252,100,4.17,rain,,,,12,294.5,1010.7,59.9,8.8,165.1,14.4,6,,2019-01-09T07:21:38,2019-01-09T19:18:36,0.1,"Rain, Partially cloudy",Partly cloudy throughout the day with late afternoon rain.,rain,"48647099999,48650099999,WMSA,WMKK"
kuala lumpur,1/10/2019,34.8,24.9,28.7,41.4,24.9,31.7,24.3,78.8,1.768,100,4.17,rain,,,,15.4,26.5,1010.4,57.9,9.3,191.8,16.5,7,,2019-01-10T07:22:01,2019-01-10T19:19:02,0.14,"Rain, Partially cloudy",Partly cloudy throughout the day with late afternoon rain.,rain,"48647099999,48650099999,WMSA,WMKK"
kuala lumpur,1/11/2019,34,25.2,28.8,41,25.2,32.1,24,76.9,0.354,100,4.17,rain,,,,11.2,49.3,1010.3,59.8,9.8,204.2,17.7,7,,2019-01-11T07:22:23,2019-01-11T19:19:29,0.17,"Rain, Partially cloudy",Partly cloudy throughout the day with early morning rain.,rain,"48647099999,48650099999,WMSA,WMKK"
kuala lumpur,1/12/2019,33.9,25,29,39,25,32.6,23.9,75.4,0,0,0,,,,,17.5,302.6,1010.4,60.6,9.5,286.8,24.7,10,,2019-01-12T07:22:45,2019-01-12T19:19:54,0.2,Partially cloudy,Partly cloudy throughout the day.,partly-cloudy-day,"48647099999,48650099999,WMSA,WMKK"
kuala lumpur,1/13/2019,34.1,25,29,40.2,25,32.8,24.1,76.4,3.536,100,4.17,rain,,,,14.1,27.5,1010.2,60.7,9.7,235.6,20.4,9,,2019-01-13T07:23:06,2019-01-13T19:20:20,0.23,"Rain, Partially cloudy",Partly cloudy throughout the day with late afternoon rain.,rain,"48647099999,48650099999,WMSA,WMKK"
kuala lumpur,1/14/2019,33,24.1,27.5,40.4,24.1,30.2,24.6,84.7,40,100,4.17,rain,,,,12.8,287.2,1009.5,58.8,9.1,149.9,12.9,5,,2019-01-14T07:23:26,2019-01-14T19:20:45,0.25,"Rain, Partially cloudy",Partly cloudy throughout the day with late afternoon rain.,rain,"48647099999,48650099999,WMSA,WMKK"
kuala lumpur,1/15/2019,33.7,24.9,28.3,40.1,24.9,31.5,24.5,81.4,0,0,0,,,,,16.9,264.4,1009.7,58.3,9,249.7,21.5,9,,2019-01-15T07:23:45,2019-01-15T19:21:09,0.3,Partially cloudy,Partly cloudy throughout the day.,partly-cloudy-day,"48647099999,48650099999,WMSA,WMKK"
kuala lumpur,1/16/2019,32.8,25.2,28.2,41.4,25.2,31.4,24.8,82.9,4.043,100,8.33,rain,,,25.9,15.9,266.8,1010.1,58.5,8.9,174.2,15.1,6,,2019-01-16T07:24:04,2019-01-16T19:21:33,0.33,"Rain, Partially cloudy",Partly cloudy throughout the day with rain.,rain,"48647099999,48650099999,WMSA,WMKK"
kuala lumpur,1/17/2019,32.9,24.7,27.2,38.9,24.7,29.2,24.2,85.2,47.464,100,8.33,rain,,,31.7,14.1,2.5,1009.3,60.1,8.6,158.1,13.6,6,,2019-01-17T07:24:21,2019-01-17T19:21:56,0.37,"Rain, Partially cloudy",Partly cloudy throughout the day with rain.,rain,"48647099999,48650099999,WMSA,WMKK"
kuala lumpur,1/18/2019,33.8,24.9,28.5,38,24.9,30.7,23.3,76.4,0.823,100,4.17,rain,,,,13.4,45.8,1009.6,57.4,9.7,220.8,19.1,8,,2019-01-18T07:24:39,2019-01-18T19:22:18,0.4,"Rain, Partially cloudy",Partly cloudy throughout the day with early morning rain.,rain,"48647099999,48650099999,WMSA,WMKK"
kuala lumpur,1/19/2019,33.9,25,28.8,39.1,25,31.5,23.3,73.7,0,0,0,,,,,11.6,30.8,1009.6,60.1,9.9,273.2,23.6,10,,2019-01-19T07:24:55,2019-01-19T19:22:40,0.43,Partially cloudy,Partly cloudy throughout the day.,partly-cloudy-day,"48647099999,48650099999,WMSA,WMKK"
kuala lumpur,1/20/2019,32.9,25,28.2,38.5,25,30.8,24.1,79.9,4.116,100,4.17,rain,,,,15,353.2,1010.3,57.4,9.5,250.4,21.5,9,,2019-01-20T07:25:10,2019-01-20T19:23:01,0.47,"Rain, Partially cloudy",Partly cloudy throughout the day with late afternoon rain.,rain,"48647099999,48650099999,WMSA,WMKK"
kuala lumpur,1/21/2019,34.5,25,28,41.4,25,30.7,24.8,84.1,3.928,100,4.17,rain,,,,19.4,284.8,1011,57.8,9,221.2,19.2,8,,2019-01-21T07:25:25,2019-01-21T19:23:22,0.5,"Rain, Partially cloudy",Partly cloudy throughout the day with late afternoon rain.,rain,"48647099999,48650099999,WMSA,WMKK"
kuala lumpur,1/22/2019,33.9,23.3,28.2,40.3,23.3,31.5,24.2,80.7,0.046,100,4.17,rain,,,,10.7,103.5,1011.9,58.2,9.4,220.7,19.2,8,,2019-01-22T07:25:39,2019-01-22T19:23:42,0.53,"Rain, Partially cloudy",Partly cloudy throughout the day with early morning rain.,rain,"48647099999,48650099999,WMSA,WMKK"
kuala lumpur,1/23/2019,34.9,25,29.3,40.2,25,32.3,23.5,73.4,0,0,0,,,,,10.5,64.8,1011.2,58.8,9.8,264.4,22.9,9,,2019-01-23T07:25:52,2019-01-23T19:24:01,0.57,Partially cloudy,Partly cloudy throughout the day.,partly-cloudy-day,"48647099999,48650099999,WMSA,WMKK"
kuala lumpur,1/24/2019,33.9,25.1,28.1,39.1,25.1,30.3,23.4,76.8,10.609,100,4.17,rain,,,,12.5,53.3,1011.5,57.8,9.6,193.3,16.6,7,,2019-01-24T07:26:04,2019-01-24T19:24:19,0.6,"Rain, Partially cloudy",Partly cloudy throughout the day with late afternoon rain.,rain,"48647099999,48650099999,WMSA,WMKK"
kuala lumpur,1/25/2019,32.5,24.9,27.8,38.7,24.9,30.9,24.4,82.2,0.046,100,4.17,rain,,,,16.9,336.2,1012,58.7,8.7,238.4,20.6,8,,2019-01-25T07:26:15,2019-01-25T19:24:37,0.63,"Rain, Partially cloudy",Partly cloudy throughout the day with late afternoon rain.,rain,"48647099999,48650099999,WMSA,WMKK"
kuala lumpur,1/26/2019,32,24.7,27.1,37.8,24.7,29.1,23.8,83,7.304,100,4.17,rain,,,,13.5,265.3,1011.8,61.4,7,195.9,16.8,7,,2019-01-26T07:26:25,2019-01-26T19:24:54,0.67,"Rain, Partially cloudy",Partly cloudy throughout the day with late afternoon rain.,rain,"48647099999,48650099999,WMSA,WMKK"
kuala lumpur,1/27/2019,32.9,24.2,28.2,36.3,24.2,30.4,23.1,76.1,1.791,100,4.17,rain,,,,10,45.7,1011.7,57.8,8.5,111.8,9.7,4,,2019-01-27T07:26:35,2019-01-27T19:25:11,0.7,"Rain, Partially cloudy",Partly cloudy throughout the day with early morning rain.,rain,"48647099999,48650099999,WMSA,WMKK"
kuala lumpur,1/28/2019,32.9,25,28.3,39.3,25,31.8,24.4,80.5,5.928,100,4.17,rain,,,,15.5,287.5,1011.4,58.8,8.9,149.5,12.9,6,,2019-01-28T07:26:44,2019-01-28T19:25:26,0.75,"Rain, Partially cloudy",Partly cloudy throughout the day with late afternoon rain.,rain,"48647099999,48650099999,WMSA,WMKK"
kuala lumpur,1/29/2019,33.1,25,27.5,39.1,25,29.2,23.9,82.3,13.284,100,4.17,rain,,,37.1,16.9,341.4,1011.1,57,9.1,204.6,17.7,7,,2019-01-29T07:26:51,2019-01-29T19:25:41,0.77,"Rain, Partially cloudy",Partly cloudy throughout the day with late afternoon rain.,rain,"48647099999,48650099999,WMSA,WMKK"
kuala lumpur,1/30/2019,32.9,24,27.5,38.7,24,30.2,23.9,81.9,4.467,100,4.17,rain,,,,11.6,217,1011.8,59.8,9,148,12.8,5,,2019-01-30T07:26:58,2019-01-30T19:25:55,0.81,"Rain, Partially cloudy",Partly cloudy throughout the day with early morning rain.,rain,"48647099999,48650099999,WMSA,WMKK"
kuala lumpur,1/31/2019,33,25,28.2,39.1,25,31.1,24,79.1,1.768,100,4.17,rain,,,,13.9,54.8,1011.8,58.3,9.6,213.6,18.4,8,,2019-01-31T07:27:04,2019-01-31T19:26:08,0.84,"Rain, Partially cloudy",Partly cloudy throughout the day with early morning rain.,rain,"48647099999,48650099999,WMSA,WMKK"
kuala lumpur,2/1/2019,34.1,25.2,29.2,40.4,25.2,32.7,23.9,74.3,0,0,0,,,,,13,356.9,1011.3,60.2,9.7,283.4,24.4,10,,2019-02-01T07:27:09,2019-02-01T19:26:21,0.87,Partially cloudy,Partly cloudy throughout the day.,partly-cloudy-day,"48647099999,48650099999,WMSA,WMKK"
kuala lumpur,2/2/2019,33.1,25.8,28.8,39.3,25.8,33.2,24.7,79.4,0,0,0,,,,,19.4,293.9,1010.7,59.3,9.6,269.4,23.2,9,,2019-02-02T07:27:13,2019-02-02T19:26:33,0.91,Partially cloudy,Partly cloudy throughout the day.,partly-cloudy-day,"48647099999,48650099999,WMSA,WMKK"
kuala lumpur,2/3/2019,34,26.1,28.8,41.8,26.1,33.5,25.3,82.2,14.791,100,8.33,rain,,,,14.3,332,1011.7,58.4,8.7,273,23.5,10,,2019-02-03T07:27:17,2019-02-03T19:26:44,0.94,"Rain, Partially cloudy",Partly cloudy throughout the day with rain.,rain,"48647099999,48650099999,WMSA,WMKK"
kuala lumpur,2/4/2019,32.6,25.1,27.4,40,25.1,30,25.3,89.6,29.841,100,8.33,rain,,,,19.6,198.7,1012.8,58.1,8.8,242.1,20.9,9,,2019-02-04T07:27:19,2019-02-04T19:26:54,0.98,"Rain, Partially cloudy",Partly cloudy throughout the day with rain.,rain,"48647099999,48650099999,WMSA,WMKK"
kuala lumpur,2/5/2019,33,24.9,28.5,41.8,24.9,32.1,24.9,82.3,0.116,100,4.17,rain,,,,10.7,258.7,1012.3,58.5,9,279.4,24.1,10,,2019-02-05T07:27:21,2019-02-05T19:27:04,0,"Rain, Partially cloudy",Partly cloudy throughout the day with early morning rain.,rain,"48647099999,48650099999,WMSA,WMKK"
kuala lumpur,2/6/2019,34,24.8,28.6,41.8,24.8,32.2,24,77.3,0,0,0,,,,,19.6,279.9,1010.7,57.8,9.8,295.5,25.4,10,,2019-02-06T07:27:22,2019-02-06T19:27:12,0.04,Partially cloudy,Partly cloudy throughout the day.,partly-cloudy-day,"48647099999,48650099999,WMSA,WMKK"
kuala lumpur,2/7/2019,33.7,25.8,28.9,40.3,25.8,32.7,23.7,74.4,0,0,0,,,,,14.3,74.1,1011.3,58.4,9.6,292,25.2,10,,2019-02-07T07:27:21,2019-02-07T19:27:20,0.08,Partially cloudy,Partly cloudy throughout the day.,partly-cloudy-day,"48647099999,48650099999,WMSA,WMKK"
kuala lumpur,2/8/2019,33.8,24.9,28.3,41.7,24.9,31.2,24.3,80.1,4.42,100,4.17,rain,,,,17.5,297.2,1011.5,58.4,9.2,295.2,25.5,10,,2019-02-08T07:27:20,2019-02-08T19:27:28,0.11,"Rain, Partially cloudy",Partly cloudy throughout the day with late afternoon rain.,rain,"48647099999,48650099999,WMSA,WMKK"
kuala lumpur,2/9/2019,34.8,24.1,27.9,43.2,24.1,30.3,24.3,82.4,21.217,100,4.17,rain,,,,17.5,214.4,1011.5,57.9,8.5,226.9,19.6,7,,2019-02-09T07:27:19,2019-02-09T19:27:34,0.15,"Rain, Partially cloudy",Partly cloudy throughout the day with late afternoon rain.,rain,"48647099999,48650099999,WMSA,WMKK"
kuala lumpur,2/10/2019,33,24.2,27.4,43.7,24.2,29.7,24.7,86.5,47.739,100,4.17,rain,,,37.1,18.4,300.4,1012.4,58.7,8.6,262.1,22.6,9,,2019-02-10T07:27:16,2019-02-10T19:27:40,0.18,"Rain, Partially cloudy",Partly cloudy throughout the day with late afternoon rain.,rain,"48647099999,48650099999,WMSA,WMKK"
kuala lumpur,2/11/2019,34.8,23.9,28.6,38.5,23.9,30.5,22.3,72,0,0,0,,,,,10.3,82.5,1012.9,55,9.9,313.5,27.2,10,,2019-02-11T07:27:12,2019-02-11T19:27:45,0.21,Partially cloudy,Partly cloudy throughout the day.,partly-cloudy-day,"48647099999,48650099999,WMSA,WMKK"
kuala lumpur,2/12/2019,35.9,23.3,29,39,23.3,30.6,20.8,64,0,0,0,,,,,13.7,39.4,1013.5,56.5,10.2,305,26.4,10,,2019-02-12T07:27:08,2019-02-12T19:27:49,0.25,Partially cloudy,Partly cloudy throughout the day.,partly-cloudy-day,"48647099999,48650099999,WMSA,WMKK"
kuala lumpur,2/13/2019,33.9,25.9,29.3,41.5,25.9,33.1,23.6,72.3,1.275,100,4.17,rain,,,,17.1,349.7,1013.4,59.7,9.8,268.1,23,9,,2019-02-13T07:27:03,2019-02-13T19:27:53,0.25,"Rain, Partially cloudy",Partly cloudy throughout the day with late afternoon rain.,rain,"48647099999,48650099999,WMSA,WMKK"
kuala lumpur,2/14/2019,33.9,26.9,29.5,39.2,30.2,34.2,24.4,75.1,0.232,100,4.17,rain,,,,13.2,108.8,1011.8,59.9,10.2,276.6,23.8,10,,2019-02-14T07:26:57,2019-02-14T19:27:56,0.31,"Rain, Partially cloudy",Partly cloudy throughout the day with early morning rain.,rain,"48647099999,48650099999,WMSA,WMKK"
kuala lumpur,2/15/2019,34,26,29.1,39,26,32.7,23.6,73.4,0,0,0,,,,,14.1,139.2,1012.1,57.4,10.3,285.5,24.6,10,,2019-02-15T07:26:50,2019-02-15T19:27:58,0.35,Partially cloudy,Partly cloudy throughout the day.,partly-cloudy-day,"48647099999,48650099999,WMSA,WMKK"
kuala lumpur,2/16/2019,33.7,25,28.7,41.2,25,32.4,24.2,77.5,0.046,100,4.17,rain,,,,20.6,338.5,1012.5,58.7,9.7,229,19.8,8,,2019-02-16T07:26:42,2019-02-16T19:27:59,0.38,"Rain, Partially cloudy",Partly cloudy throughout the day with late afternoon rain.,rain,"48647099999,48650099999,WMSA,WMKK"
kuala lumpur,2/17/2019,32,25.7,28.9,39,25.7,33.1,24.7,79,2.435,100,4.17,rain,,,,15.1,184.7,1011.8,57.5,9.4,250.3,21.5,9,,2019-02-17T07:26:34,2019-02-17T19:28:00,0.42,"Rain, Partially cloudy",Partly cloudy throughout the day with early morning rain.,rain,"48647099999,48650099999,WMSA,WMKK"
kuala lumpur,2/18/2019,32.9,24.2,27.1,40.4,24.2,29.8,24.6,86.7,0.884,100,4.17,rain,,,,11.5,178.6,1011.6,58.8,7.9,153.6,13.3,5,,2019-02-18T07:26:25,2019-02-18T19:28:00,0.45,"Rain, Partially cloudy",Partly cloudy throughout the day with late afternoon rain.,rain,"48647099999,48650099999,WMSA,WMKK"
kuala lumpur,2/19/2019,32,25.8,27.6,37.9,25.8,30.5,24.8,85.2,5.536,100,8.33,rain,,,,13.8,25,1012,61.8,8.1,256.9,22.2,9,,2019-02-19T07:26:15,2019-02-19T19:28:00,0.5,"Rain, Partially cloudy",Partly cloudy throughout the day with rain.,rain,"48647099999,48650099999,WMSA,WMKK"
kuala lumpur,2/20/2019,33.9,25,28.2,40,25,30.9,24.4,81.6,23.008,100,8.33,rain,,,,19.2,302,1013,57.9,8.8,268.6,23.2,10,,2019-02-20T07:26:05,2019-02-20T19:27:58,0.52,"Rain, Partially cloudy",Partly cloudy throughout the day with rain.,rain,"48647099999,48650099999,WMSA,WMKK"
kuala lumpur,2/21/2019,34,25,28.6,40.3,25,32.3,24.8,81.2,0,0,0,,,,,17.3,279.2,1012.3,59.2,8.8,295.8,25.4,10,,2019-02-21T07:25:54,2019-02-21T19:27:56,0.55,Partially cloudy,Partly cloudy throughout the day.,partly-cloudy-day,"48647099999,48650099999,WMSA,WMKK"
kuala lumpur,2/22/2019,34,25.9,29.4,43.2,25.9,34.8,25.5,80.6,0,0,0,,,,,12.8,254.5,1011,59.8,7.2,303.4,26.1,10,,2019-02-22T07:25:42,2019-02-22T19:27:54,0.58,Partially cloudy,Partly cloudy throughout the day.,partly-cloudy-day,"48647099999,48650099999,WMSA,WMKK"
kuala lumpur,2/23/2019,34.8,25.1,29.3,39.5,25.1,32.8,23.6,73.1,0,0,0,,,,,14.3,350,1009.6,58.7,9.6,233.2,20.2,8,,2019-02-23T07:25:29,2019-02-23T19:27:51,0.62,Partially cloudy,Partly cloudy throughout the day.,partly-cloudy-day,"48647099999,48650099999,WMSA,WMKK"
kuala lumpur,2/24/2019,34.8,25,29.1,40.5,25,32.4,23.9,75.2,3.536,100,4.17,rain,,,,14.1,297.5,1009.7,57.8,9,284.7,24.6,9,,2019-02-24T07:25:16,2019-02-24T19:27:47,0.65,"Rain, Partially cloudy",Partly cloudy throughout the day with late afternoon rain.,rain,"48647099999,48650099999,WMSA,WMKK"
kuala lumpur,2/25/2019,34.8,24.9,29.2,39.6,24.9,32,23.3,72.6,0.177,100,4.17,rain,,,,17.5,185.7,1009.8,59.7,9.3,305.1,26.6,10,,2019-02-25T07:25:02,2019-02-25T19:27:43,0.68,"Rain, Partially cloudy",Partly cloudy throughout the day with early morning rain.,rain,"48647099999,48650099999,WMSA,WMKK"
kuala lumpur,2/26/2019,34.1,24,29.2,39.5,24,32.7,23.2,71.7,2.899,100,4.17,rain,,,,14.1,106.8,1008.7,59.3,9.6,288.3,25,10,,2019-02-26T07:24:48,2019-02-26T19:27:38,0.75,"Rain, Partially cloudy",Partly cloudy throughout the day with late afternoon rain.,rain,"48647099999,48650099999,WMSA,WMKK"
kuala lumpur,2/27/2019,34.8,26.9,29.9,41.2,29.3,34.8,24.1,72,0.177,100,4.17,rain,,,,14.8,27.9,1007.9,59.2,9.8,291.5,25.2,10,,2019-02-27T07:24:32,2019-02-27T19:27:33,0.75,"Rain, Partially cloudy",Partly cloudy throughout the day with late afternoon rain.,rain,"48647099999,48650099999,WMSA,WMKK"
kuala lumpur,2/28/2019,33.9,26,28.4,40.3,26,31.5,24.3,79.8,8.933,100,4.17,rain,,,,18.6,327,1008.7,57.6,9.5,279.4,24.1,9,,2019-02-28T07:24:17,2019-02-28T19:27:27,0.78,"Rain, Partially cloudy",Partly cloudy throughout the day with late afternoon rain.,rain,"48647099999,48650099999,WMSA,WMKK"
kuala lumpur,3/1/2019,33.9,25.8,28.1,41.6,25.8,31.7,25.2,85,13.319,100,4.17,rain,,,,17.7,68.2,1009.5,57.9,8.6,291.3,25.3,10,,2019-03-01T07:24:01,2019-03-01T19:27:21,0.82,"Rain, Partially cloudy",Partly cloudy throughout the day with late afternoon rain.,rain,"48647099999,48650099999,WMSA,WMKK"
kuala lumpur,3/2/2019,33.9,24.9,28.9,43,24.9,32.9,24.7,79.3,0,0,0,,,,,12.8,284.2,1009.1,59.7,9.4,288.7,24.8,10,,2019-03-02T07:23:44,2019-03-02T19:27:14,0.85,Partially cloudy,Partly cloudy throughout the day.,partly-cloudy-day,"48647099999,48650099999,WMSA,WMKK"
kuala lumpur,3/3/2019,34.7,25.7,29.5,42.7,25.7,34.3,24.8,76.9,0,0,0,,,,,16.1,297.8,1008.2,57.8,9.6,295.1,25.4,10,,2019-03-03T07:23:27,2019-03-03T19:27:06,0.88,Partially cloudy,Partly cloudy throughout the day.,partly-cloudy-day,"48647099999,48650099999,WMSA,WMKK"
kuala lumpur,3/4/2019,33.8,25.9,29.5,41.7,25.9,34.4,24.9,77.4,0.023,100,4.17,rain,,,,16.1,295.6,1008.5,59.4,8.8,289.6,25,10,,2019-03-04T07:23:09,2019-03-04T19:26:59,0.92,"Rain, Partially cloudy",Partly cloudy throughout the day with late afternoon rain.,rain,"48647099999,48650099999,WMSA,WMKK"
kuala lumpur,3/5/2019,33.9,25.9,29.8,41.5,25.9,34.3,24.4,74.3,0.232,100,4.17,rain,,,,21.7,290.6,1009.8,58.7,8.7,249.5,21.6,9,,2019-03-05T07:22:51,2019-03-05T19:26:50,0.95,"Rain, Partially cloudy",Partly cloudy throughout the day with late afternoon rain.,rain,"48647099999,48650099999,WMSA,WMKK"
kuala lumpur,3/6/2019,35.9,25,29.6,41.3,25,32.5,23.1,70.6,0,0,0,,,,,14.3,212.4,1010.8,57.7,9.7,252.6,22,9,,2019-03-06T07:22:32,2019-03-06T19:26:42,0.98,Partially cloudy,Partly cloudy throughout the day.,partly-cloudy-day,"48647099999,48650099999,WMSA,WMKK"
kuala lumpur,3/7/2019,32.9,26.6,29.2,41.6,26.6,34.2,24.7,77.6,0.223,100,4.17,rain,,,,15.9,251.7,1010.8,59.1,8.6,188.4,16.3,7,,2019-03-07T07:22:13,2019-03-07T19:26:33,0,"Rain, Partially cloudy",Partly cloudy throughout the day with late afternoon rain.,rain,"48647099999,48650099999,WMSA,WMKK"
kuala lumpur,3/8/2019,34.8,24.7,28.3,41.6,24.7,30.9,24,79,16.797,100,4.17,rain,,,,14.6,187.2,1010.6,58.8,8.4,195.9,17.1,8,,2019-03-08T07:21:53,2019-03-08T19:26:23,0.05,"Rain, Partially cloudy",Partly cloudy throughout the day with late afternoon rain.,rain,"48647099999,48650099999,WMSA,WMKK"
kuala lumpur,3/9/2019,35.8,25.1,28.3,45.8,25.1,30.9,24.4,81.1,16.797,100,4.17,rain,,,,19.6,174.9,1010.7,58.5,6.9,277.8,24,10,,2019-03-09T07:21:34,2019-03-09T19:26:14,0.09,"Rain, Partially cloudy",Partly cloudy throughout the day with late afternoon rain.,rain,"48647099999,48650099999,WMSA,WMKK"
kuala lumpur,3/10/2019,34.5,23.7,27.3,43.9,23.7,29.4,23.8,82.8,41.551,100,4.17,rain,,,64.8,33.9,255.8,1011.4,58.3,7.9,219.3,19,9,,2019-03-10T07:21:13,2019-03-10T19:26:03,0.12,"Rain, Partially cloudy",Partly cloudy throughout the day with late afternoon rain.,rain,"48647099999,48650099999,WMSA,WMKK"
kuala lumpur,3/11/2019,34,24.2,28.1,43,24.2,31.7,24.4,81.6,0,0,0,,,,,17.7,283.3,1011.8,57.9,8.1,155.8,13.4,6,,2019-03-11T07:20:53,2019-03-11T19:25:53,0.16,Partially cloudy,Partly cloudy throughout the day.,partly-cloudy-day,"48647099999,48650099999,WMSA,WMKK"
kuala lumpur,3/12/2019,34.9,23.5,28.9,43.4,23.5,33.6,24.6,78.7,0.2,100,8.33,rain,,,,17.7,295.9,1011.7,59.2,8.9,218.7,18.9,8,,2019-03-12T07:20:32,2019-03-12T19:25:42,0.19,"Rain, Partially cloudy",Partly cloudy throughout the day with rain in the morning and afternoon.,rain,"48647099999,48650099999,WMSA,WMKK"
kuala lumpur,3/13/2019,34,26,29.5,42,26,34.5,24.9,77.4,0.023,100,4.17,rain,,,,19.9,289.6,1011.6,53.1,9.2,191.2,16.6,7,,2019-03-13T07:20:10,2019-03-13T19:25:31,0.23,"Rain, Partially cloudy",Partly cloudy throughout the day with early morning rain.,rain,"48647099999,48650099999,WMSA,WMKK"
kuala lumpur,3/14/2019,35.9,25.8,30.1,41.3,25.8,34.4,23.7,70.8,0,0,0,,,,,13.2,73.4,1011.9,54.5,9.8,294.3,25.3,10,,2019-03-14T07:19:49,2019-03-14T19:25:20,0.25,Partially cloudy,Partly cloudy throughout the day.,partly-cloudy-day,"48647099999,48650099999,WMSA,WMKK"
kuala lumpur,3/15/2019,36,24.9,29.6,39.2,24.9,32.4,22.4,67.4,0,0,0,,,,,14.6,100,1011.9,58.2,9,248,21.4,8,,2019-03-15T07:19:27,2019-03-15T19:25:08,0.3,Partially cloudy,Partly cloudy throughout the day.,partly-cloudy-day,"48647099999,48650099999,WMSA,WMKK"
kuala lumpur,3/16/2019,37,25,30.1,39.5,25,32.9,22.2,66,0,0,0,,,,,12.8,48.4,1011.6,50.5,8.9,315.4,27.2,10,,2019-03-16T07:19:05,2019-03-16T19:24:57,0.33,Partially cloudy,Partly cloudy throughout the day.,partly-cloudy-day,"48647099999,48650099999,WMSA,WMKK"
kuala lumpur,3/17/2019,36,25.2,30.1,39.4,25.2,33.2,22.3,65.5,0,0,0,,,,35.3,13,75.2,1011.4,58,7.8,289,24.9,10,,2019-03-17T07:18:43,2019-03-17T19:24:45,0.36,Partially cloudy,Partly cloudy throughout the day.,partly-cloudy-day,"48647099999,48650099999,WMSA,WMKK"
kuala lumpur,3/18/2019,35.8,26,29.6,40.5,26,33.1,23.1,69.5,1.768,100,4.17,rain,,,,14.3,134.1,1010.7,58.1,8.5,308.7,26.7,10,,2019-03-18T07:18:20,2019-03-18T19:24:33,0.4,"Rain, Partially cloudy",Partly cloudy throughout the day with late afternoon rain.,rain,"48647099999,48650099999,WMSA,WMKK"
kuala lumpur,3/19/2019,35.9,26,30.4,42.6,26,34.6,23.7,69.1,0,0,0,,,,,15.7,287.8,1009.7,57.7,9.1,305.3,26.2,10,,2019-03-19T07:17:57,2019-03-19T19:24:20,0.43,Partially cloudy,Partly cloudy throughout the day.,partly-cloudy-day,"48647099999,48650099999,WMSA,WMKK"
kuala lumpur,3/20/2019,34.6,27,30.3,41.6,29.6,35.9,24.5,71.5,0,0,0,,,,,20.6,296.6,1009.6,57.5,5.9,221.7,19,8,,2019-03-20T07:17:35,2019-03-20T19:24:08,0.47,Partially cloudy,Partly cloudy throughout the day.,partly-cloudy-day,"48647099999,48650099999,WMSA,WMKK"
kuala lumpur,3/21/2019,32,26,28.1,39,26,32,24.8,82.7,6.791,100,8.33,rain,,,,25.1,306.9,1010.5,57.4,7.3,232.8,20.1,8,,2019-03-21T07:17:12,2019-03-21T19:23:55,0.5,"Rain, Partially cloudy",Partly cloudy throughout the day with rain.,rain,"48647099999,48650099999,WMSA,WMKK"
kuala lumpur,3/22/2019,34.8,25,29.5,43,25,33.7,24.9,78.4,0.177,100,4.17,rain,,,,20.3,299.7,1010.4,60.2,9.6,167.9,14.6,6,,2019-03-22T07:16:49,2019-03-22T19:23:43,0.54,"Rain, Partially cloudy",Partly cloudy throughout the day with early morning rain.,rain,"48647099999,48650099999,WMSA,WMKK"
kuala lumpur,3/23/2019,34.5,26.9,29.5,43.2,30.6,35.3,25.3,78.8,0.116,100,4.17,rain,,,,19.6,296.1,1009.8,59,9.4,258,22.5,9,,2019-03-23T07:16:25,2019-03-23T19:23:30,0.57,"Rain, Partially cloudy",Partly cloudy throughout the day with late afternoon rain.,rain,"48647099999,48650099999,WMSA,WMKK"
kuala lumpur,3/24/2019,34.9,25.9,28.3,43,25.9,32.1,24.8,82.5,1.768,100,4.17,rain,,,,15.9,308.4,1009.3,59.3,8.8,212,18.1,8,,2019-03-24T07:16:02,2019-03-24T19:23:17,0.6,"Rain, Partially cloudy",Partly cloudy throughout the day with late afternoon rain.,rain,"48647099999,48650099999,WMSA,WMKK"
kuala lumpur,3/25/2019,35,25,27.8,42.8,25,29.8,24.2,82.5,1.684,100,4.17,rain,,,,18.2,335.7,1010.1,57.6,8.8,199.8,17.3,8,,2019-03-25T07:15:39,2019-03-25T19:23:04,0.63,"Rain, Partially cloudy",Partly cloudy throughout the day with late afternoon rain.,rain,"48647099999,48650099999,WMSA,WMKK"
kuala lumpur,3/26/2019,36,25.8,29.5,46,25.8,33.9,25,78.3,0,0,0,,,,,16.6,5.8,1010.5,59.8,9.7,227.1,19.6,8,,2019-03-26T07:15:15,2019-03-26T19:22:52,0.67,Partially cloudy,Partly cloudy throughout the day.,partly-cloudy-day,"48647099999,48650099999,WMSA,WMKK"
kuala lumpur,3/27/2019,34.9,27,29.3,43,30.5,34.3,24.9,78.3,15.913,100,4.17,rain,,,,19.2,336.5,1011.5,57.2,9.4,248.2,21.4,8,,2019-03-27T07:14:52,2019-03-27T19:22:39,0.7,"Rain, Partially cloudy",Partly cloudy throughout the day with late afternoon rain.,rain,"48647099999,48650099999,WMSA,WMKK"
kuala lumpur,3/28/2019,33.9,26,29,43.2,26,33.3,24.9,79.6,0.707,100,4.17,rain,,,,14.8,191.2,1011.1,57.5,9.2,154.1,13.4,5,,2019-03-28T07:14:29,2019-03-28T19:22:26,0.75,"Rain, Partially cloudy",Partly cloudy throughout the day with late afternoon rain.,rain,"48647099999,48650099999,WMSA,WMKK"
kuala lumpur,3/29/2019,34.5,26,28.4,40.6,26,32,24.9,82.3,0.177,100,4.17,rain,,,,17.5,170.3,1009.6,57.9,8.7,235.7,20.4,9,,2019-03-29T07:14:05,2019-03-29T19:22:13,0.76,"Rain, Partially cloudy",Partly cloudy throughout the day with late afternoon rain.,rain,"48647099999,48650099999,WMSA,WMKK"
kuala lumpur,3/30/2019,33.1,26,29.1,39.5,26,33.9,25,79.2,1.971,100,4.17,rain,,,,18.6,244.7,1009.8,57.4,7.5,244.7,21.2,8,,2019-03-30T07:13:42,2019-03-30T19:22:00,0.8,"Rain, Partially cloudy",Partly cloudy throughout the day with afternoon rain.,rain,"48647099999,48650099999,WMSA,WMKK"
kuala lumpur,3/31/2019,33.7,24,28.3,41.2,24,32.6,24.9,82.9,20.336,100,8.33,rain,,,51.8,28.2,282,1010.8,59.1,8.6,158.5,13.7,6,,2019-03-31T07:13:19,2019-03-31T19:21:47,0.83,"Rain, Partially cloudy",Partly cloudy throughout the day with rain.,rain,"48647099999,48650099999,WMSA,WMKK"
kuala lumpur,4/1/2019,32.2,24.9,28.1,38.3,24.9,31,24,79.8,5.113,100,8.33,rain,,,,20.8,302.3,1012,58.4,9.4,141.8,12.1,6,,2019-04-01T07:12:56,2019-04-01T19:21:35,0.86,"Rain, Partially cloudy",Partly cloudy throughout the day with rain.,rain,"48647099999,48650099999,WMSA,WMKK"
kuala lumpur,4/2/2019,33.8,24.7,28,40.1,24.7,30.7,24.3,82.1,38.898,100,4.17,rain,,,,20.6,246.7,1011,57.5,9.2,208.2,18,7,,2019-04-02T07:12:33,2019-04-02T19:21:22,0.9,"Rain, Partially cloudy",Partly cloudy throughout the day with late afternoon rain.,rain,"48647099999,48650099999,WMSA,WMKK"
kuala lumpur,4/3/2019,33.6,25,27,40.4,25,28.8,24.7,88.2,26.168,100,8.33,rain,,,40.7,18.6,161.4,1011.1,58.6,9,154.6,13.4,5,,2019-04-03T07:12:10,2019-04-03T19:21:10,0.93,"Rain, Partially cloudy",Partly cloudy throughout the day with rain.,rain,"48647099999,48650099999,WMSA,WMKK"
kuala lumpur,4/4/2019,33.3,24.1,26.9,40.3,24.1,29,24.4,87.7,40.667,100,4.17,rain,,,,23,319.8,1011.1,57.3,7.4,266.2,22.9,9,,2019-04-04T07:11:47,2019-04-04T19:20:58,0.96,"Rain, Partially cloudy",Partly cloudy throughout the day with late afternoon rain.,rain,"48647099999,48650099999,WMSA,WMKK"
kuala lumpur,4/5/2019,33.5,24.2,27.3,42.7,24.2,29.7,24.2,84.1,5.536,100,4.17,rain,,,,18.8,295.8,1011.2,58.3,9.7,261.9,22.7,9,,2019-04-05T07:11:25,2019-04-05T19:20:46,0,"Rain, Partially cloudy",Partly cloudy throughout the day with late afternoon rain.,rain,"48647099999,48650099999,WMSA,WMKK"
kuala lumpur,4/6/2019,33.9,24.1,27.5,41.6,24.1,30,24.4,84.9,17.377,100,4.17,rain,,,,15.7,181,1010.7,58.4,8.8,297.2,25.7,10,,2019-04-06T07:11:02,2019-04-06T19:20:34,0.03,"Rain, Partially cloudy",Partly cloudy throughout the day with late afternoon rain.,rain,"48647099999,48650099999,WMSA,WMKK"
kuala lumpur,4/7/2019,34.8,25,28.7,44.4,25,32,24.4,79.5,0,0,0,,,,,17.3,274.5,1010.2,59.1,8.5,305.7,26.5,10,,2019-04-07T07:10:40,2019-04-07T19:20:22,0.06,Partially cloudy,Partly cloudy throughout the day.,partly-cloudy-day,"48647099999,48650099999,WMSA,WMKK"
kuala lumpur,4/8/2019,34.8,25.8,29.4,43.4,25.8,33.8,24.9,78.2,1.044,100,4.17,rain,,,,21.4,304.2,1009.2,59.6,9.8,285.3,24.6,10,,2019-04-08T07:10:18,2019-04-08T19:20:10,0.1,"Rain, Partially cloudy",Partly cloudy throughout the day with late afternoon rain.,rain,"48647099999,48650099999,WMSA,WMKK"
kuala lumpur,4/9/2019,32.6,26.9,29.4,40.4,30.4,35.3,25.3,79.4,0.371,100,12.5,rain,,,,13.5,238.6,1009.2,59.6,9,108.9,9.4,4,,2019-04-09T07:09:57,2019-04-09T19:19:59,0.13,"Rain, Partially cloudy",Partly cloudy throughout the day with a chance of rain throughout the day.,rain,"48647099999,48650099999,WMSA,WMKK"
kuala lumpur,4/10/2019,34.8,26,29.9,39.5,26,34.4,24.3,74.1,0,0,0,,,,,13.7,251.7,1009.5,57.7,9.6,258,22.4,9,,2019-04-10T07:09:35,2019-04-10T19:19:48,0.17,Partially cloudy,Partly cloudy throughout the day.,partly-cloudy-day,"48647099999,48650099999,WMSA,WMKK"
kuala lumpur,4/11/2019,35.7,26.7,30.2,41.7,29.9,35.3,24.3,72.8,0,0,0,,,,,15.5,267.6,1008.8,57.8,8.4,149.4,12.9,5,,2019-04-11T07:09:14,2019-04-11T19:19:37,0.21,Partially cloudy,Partly cloudy throughout the day.,partly-cloudy-day,"48647099999,48650099999,WMSA,WMKK"
kuala lumpur,4/12/2019,33.8,26.7,29.1,40.2,26.7,34.5,25.2,80.2,24.754,100,4.17,rain,,,,18.2,202.6,1009,58.7,9.3,246.5,21.2,8,,2019-04-12T07:08:53,2019-04-12T19:19:26,0.24,"Rain, Partially cloudy",Partly cloudy throughout the day with late afternoon rain.,rain,"48647099999,48650099999,WMSA,WMKK"
kuala lumpur,4/13/2019,33.9,26.1,28.4,43.2,26.1,32.1,25.3,84.6,12.377,100,4.17,rain,,,,17.3,179,1009.6,59.7,8.6,245.7,21.2,9,,2019-04-13T07:08:33,2019-04-13T19:19:16,0.25,"Rain, Partially cloudy",Partly cloudy throughout the day with late afternoon rain.,rain,"48647099999,48650099999,WMSA,WMKK"
kuala lumpur,4/14/2019,33.9,25.9,28.4,40.4,25.9,30.9,24.8,82.9,31.583,100,8.33,rain,,,,14.6,154.8,1009.9,58.3,8.4,195.7,16.9,6,,2019-04-14T07:08:13,2019-04-14T19:19:06,0.31,"Rain, Partially cloudy",Partly cloudy throughout the day with rain.,rain,"48647099999,48650099999,WMSA,WMKK"
kuala lumpur,4/15/2019,33.9,25,29.2,43,25,33.7,25.2,80.7,0.023,100,4.17,rain,,,,14.3,268.1,1009.7,57.9,8.7,190.8,16.6,7,,2019-04-15T07:07:53,2019-04-15T19:18:57,0.35,"Rain, Partially cloudy",Partly cloudy throughout the day with early morning rain.,rain,"48647099999,48650099999,WMSA,WMKK"
kuala lumpur,4/16/2019,34.9,27,30,44.8,31.1,36.6,25.8,79.7,0.707,100,4.17,rain,,,,15.9,221.6,1009.6,58.9,6.7,238.8,20.6,8,,2019-04-16T07:07:33,2019-04-16T19:18:47,0.38,"Rain, Partially cloudy",Partly cloudy throughout the day with late afternoon rain.,rain,"48647099999,48650099999,WMSA,WMKK"
kuala lumpur,4/17/2019,34.7,24,29,43.4,24,33.9,25,80.3,7.956,100,4.17,rain,,,37.1,17.7,226.6,1010,58.9,9.1,267.8,23.1,9,,2019-04-17T07:07:14,2019-04-17T19:18:38,0.42,"Rain, Partially cloudy",Partly cloudy throughout the day with early morning rain.,rain,"48647099999,48650099999,WMSA,WMKK"
kuala lumpur,4/18/2019,34.8,26.1,29.1,44.6,26.1,34.4,25.2,80.8,10.609,100,4.17,rain,,,,15.9,264.7,1009.3,58.3,8.2,269.9,23.3,9,,2019-04-18T07:06:55,2019-04-18T19:18:30,0.45,"Rain, Partially cloudy",Partly cloudy throughout the day with late afternoon rain.,rain,"48647099999,48650099999,WMSA,WMKK"
kuala lumpur,4/19/2019,34.9,25,29.6,43.3,25,34.1,25.1,78.4,0.081,100,4.17,rain,,,,18.2,296.2,1008.3,57.7,8,290.3,25,10,,2019-04-19T07:06:37,2019-04-19T19:18:21,0.5,"Rain, Partially cloudy",Partly cloudy throughout the day with morning rain.,rain,"48647099999,48650099999,WMSA,WMKK"
kuala lumpur,4/20/2019,33.1,26.5,28.7,42.2,26.5,34.1,25.5,83.7,2.348,100,4.17,rain,,,33.5,20.6,306.6,1007.5,57.3,8.5,96.1,8.4,4,,2019-04-20T07:06:19,2019-04-20T19:18:13,0.52,"Rain, Partially cloudy",Partly cloudy throughout the day with late afternoon rain.,rain,"48647099999,48650099999,WMSA,WMKK"
kuala lumpur,4/21/2019,35.7,25,29.5,42.4,25,33.8,25,78.5,0.023,100,4.17,rain,,,,12.8,242.3,1006.4,58.9,9,132.8,11.4,5,,2019-04-21T07:06:02,2019-04-21T19:18:06,0.55,"Rain, Partially cloudy",Partly cloudy throughout the day with early morning rain.,rain,"48647099999,48650099999,WMSA,WMKK"
kuala lumpur,4/22/2019,33.7,26.3,28.9,40.4,26.3,33.9,25.3,82.1,45.365,100,8.33,rain,,,35.3,15.3,179.9,1006.5,58.1,7.9,246.3,21.1,8,,2019-04-22T07:05:45,2019-04-22T19:17:59,0.59,"Rain, Partially cloudy",Partly cloudy throughout the day with rain.,rain,"48647099999,48650099999,WMSA,WMKK"
kuala lumpur,4/23/2019,34.8,26,28.8,43,26,33.1,25.2,82.7,18.565,100,4.17,rain,,,,14.3,264.9,1007.4,57.9,8.2,224.4,19.4,8,,2019-04-23T07:05:28,2019-04-23T19:17:52,0.62,"Rain, Partially cloudy",Partly cloudy throughout the day with late afternoon rain.,rain,"48647099999,48650099999,WMSA,WMKK"
kuala lumpur,4/24/2019,35,25.1,29.2,42,25.1,33.5,25.2,81,6.42,100,8.33,rain,,,31.7,12.5,149.7,1008.2,57.7,8.5,234.9,20.2,8,,2019-04-24T07:05:12,2019-04-24T19:17:46,0.65,"Rain, Partially cloudy",Partly cloudy throughout the day with rain clearing later.,rain,"48647099999,48650099999,WMSA,WMKK"
kuala lumpur,4/25/2019,33.9,26.2,29.2,43.6,26.2,34.9,25.8,83.2,14.145,100,4.17,rain,,,,14.1,271.4,1007.8,60.8,7.7,282.9,24.4,10,,2019-04-25T07:04:57,2019-04-25T19:17:40,0.68,"Rain, Partially cloudy",Partly cloudy throughout the day with late afternoon rain.,rain,"48647099999,48650099999,WMSA,WMKK"
kuala lumpur,4/26/2019,31.5,26.1,27.4,39.8,26.1,31,25.4,89.4,4.974,100,8.33,rain,,,,17.1,236.8,1008.2,57.4,8,104.7,9,3,,2019-04-26T07:04:42,2019-04-26T19:17:35,0.72,"Rain, Partially cloudy",Partly cloudy throughout the day with rain.,rain,"48647099999,48650099999,WMSA,WMKK"
kuala lumpur,4/27/2019,32,25,28.5,38,25,32.1,24.7,81.1,2.675,100,4.17,rain,,,,11,167.9,1009.2,58,9.5,157.9,13.7,6,,2019-04-27T07:04:27,2019-04-27T19:17:30,0.75,"Rain, Partially cloudy",Partly cloudy throughout the day with morning rain.,rain,"48647099999,48650099999,WMSA,WMKK"
kuala lumpur,4/28/2019,34.9,27,30.3,43.2,30.5,36.3,25.1,74.8,0,0,0,,,,,12.1,247.4,1009.2,57.3,9.5,229,19.8,8,,2019-04-28T07:04:13,2019-04-28T19:17:25,0.78,Partially cloudy,Partly cloudy throughout the day.,partly-cloudy-day,"48647099999,48650099999,WMSA,WMKK"
kuala lumpur,4/29/2019,34.7,26.1,29.5,42.6,26.1,35.1,25.2,78.8,1.061,100,8.33,rain,,,,22.4,241.3,1008.8,60.2,9.5,243.3,21,8,,2019-04-29T07:04:00,2019-04-29T19:17:21,0.81,"Rain, Partially cloudy",Partly cloudy throughout the day with rain.,rain,"48647099999,48650099999,WMSA,WMKK"
kuala lumpur,4/30/2019,30.9,24.2,27.7,35.6,24.2,30.9,23.8,80.4,6.188,100,4.17,rain,,,,18.4,313.6,1010.1,59.7,8.9,201.5,17.5,7,,2019-04-30T07:03:47,2019-04-30T19:17:18,0.85,"Rain, Partially cloudy",Partly cloudy throughout the day with afternoon rain.,rain,"48647099999,48650099999,WMSA,WMKK"
kuala lumpur,5/1/2019,35,25,29.5,42.8,25,33.8,24.1,74.2,0,0,0,,,,,18.2,307.2,1009.6,58.1,10,256.8,22.2,9,,2019-05-01T07:03:35,2019-05-01T19:17:15,0.88,Partially cloudy,Partly cloudy throughout the day.,partly-cloudy-day,"48647099999,48650099999,WMSA,WMKK"
kuala lumpur,5/2/2019,35.5,26.9,30.3,44.6,30.2,36.8,25.3,75.6,0,0,0,,,,,17.5,285.2,1009.9,58.5,9.8,205.6,17.8,7,,2019-05-02T07:03:23,2019-05-02T19:17:12,0.91,Partially cloudy,Partly cloudy throughout the day.,partly-cloudy-day,"48647099999,48650099999,WMSA,WMKK"
kuala lumpur,5/3/2019,34.5,26.5,29.6,44.3,26.5,35.6,25.8,81.2,9,100,8.33,rain,,,,16.9,307.6,1010.3,58.5,9.7,247.3,21.2,9,,2019-05-03T07:03:12,2019-05-03T19:17:10,0.94,"Rain, Partially cloudy",Partly cloudy throughout the day with rain.,rain,"48647099999,48650099999,WMSA,WMKK"
kuala lumpur,5/4/2019,34,26,28.7,42.2,26,33,25.1,81.7,0,0,0,,,,,14.6,318.5,1010.8,57.7,9.6,193.8,16.9,6,,2019-05-04T07:03:02,2019-05-04T19:17:09,0.97,Partially cloudy,Partly cloudy throughout the day.,partly-cloudy-day,"48647099999,48650099999,WMSA,WMKK"
kuala lumpur,5/5/2019,33.8,25.9,29.2,39.8,25.9,33,24.1,75.3,0.046,100,4.17,rain,,,,21.9,305.4,1011.6,56.5,10.1,225.4,19.5,8,,2019-05-05T07:02:52,2019-05-05T19:17:07,0,"Rain, Partially cloudy",Partly cloudy throughout the day with morning rain.,rain,"48647099999,48650099999,WMSA,WMKK"
kuala lumpur,5/6/2019,34,25.8,29.1,40.6,25.8,32.9,24.1,75.7,0.884,100,4.17,rain,,,,23,319.1,1010.5,57.6,9.8,241.2,20.7,8,,2019-05-06T07:02:42,2019-05-06T19:17:07,0.04,"Rain, Partially cloudy",Partly cloudy throughout the day with afternoon rain.,rain,"48647099999,48650099999,WMSA,WMKK"
kuala lumpur,5/7/2019,34.7,26,29.6,42.6,26,33.7,24.1,73.7,0,0,0,,,,,25,316.2,1008.7,57.1,10.2,249.3,21.5,9,,2019-05-07T07:02:34,2019-05-07T19:17:07,0.08,Partially cloudy,Partly cloudy throughout the day.,partly-cloudy-day,"48647099999,48650099999,WMSA,WMKK"
kuala lumpur,5/8/2019,33.1,26,29.2,39.3,26,33,23.9,74.4,0,0,0,,,,,21.7,318.7,1008.9,58.2,10,189.6,16.3,7,,2019-05-08T07:02:26,2019-05-08T19:17:07,0.12,Partially cloudy,Partly cloudy throughout the day.,partly-cloudy-day,"48647099999,48650099999,WMSA,WMKK"
kuala lumpur,5/9/2019,33.1,25.9,29.2,39.3,25.9,33.2,24,74.6,0.707,100,4.17,rain,,,33.5,18.2,302.1,1009.1,58.8,9.9,140.2,12.3,5,,2019-05-09T07:02:18,2019-05-09T19:17:08,0.15,"Rain, Partially cloudy",Partly cloudy throughout the day with morning rain.,rain,"48647099999,48650099999,WMSA,WMKK"
kuala lumpur,5/10/2019,35.9,26,30.3,44.1,26,35.9,24.9,74.2,0,0,0,,,,,17.7,303.6,1009.8,58.6,9.7,182.2,15.7,6,,2019-05-10T07:02:11,2019-05-10T19:17:10,0.19,Partially cloudy,Partly cloudy throughout the day.,partly-cloudy-day,"48647099999,48650099999,WMSA,WMKK"
kuala lumpur,5/11/2019,33.2,26.9,29.9,40.6,30.8,35.9,25.2,77.1,0,0,0,,,,,13.2,291.4,1010.3,57.3,9.8,136.9,11.8,5,,2019-05-11T07:02:05,2019-05-11T19:17:12,0.22,Partially cloudy,Partly cloudy throughout the day.,partly-cloudy-day,"48647099999,48650099999,WMSA,WMKK"
kuala lumpur,5/12/2019,33.9,26.9,29.6,40.7,30.8,35.4,25.4,79.2,0,0,0,,,,,15.7,280.6,1009.9,58.1,9.3,184.7,16,6,,2019-05-12T07:02:00,2019-05-12T19:17:14,0.25,Partially cloudy,Partly cloudy throughout the day.,partly-cloudy-day,"48647099999,48650099999,WMSA,WMKK"
kuala lumpur,5/13/2019,35.7,26.9,30.2,44.2,30.4,36.2,25.1,75.9,0.046,100,4.17,rain,,,,20.8,290.7,1009.3,57.4,10,234.5,20.3,8,,2019-05-13T07:01:55,2019-05-13T19:17:17,0.29,"Rain, Partially cloudy",Partly cloudy throughout the day with late afternoon rain.,rain,"48647099999,48650099999,WMSA,WMKK"
kuala lumpur,5/14/2019,34.6,26.9,29.5,42.5,30.4,35.1,25.2,79.1,0.023,100,4.17,rain,,,,19.4,241.4,1009.2,57.5,9.3,166.6,14.5,7,,2019-05-14T07:01:50,2019-05-14T19:17:21,0.33,"Rain, Partially cloudy",Partly cloudy throughout the day with afternoon rain.,rain,"48647099999,48650099999,WMSA,WMKK"
kuala lumpur,5/15/2019,33.9,26,28.4,41.8,26,33,25.2,83.8,10.728,100,8.33,rain,,,46.4,19.4,268.1,1010.1,58.3,8.3,147.7,12.8,5,,2019-05-15T07:01:47,2019-05-15T19:17:25,0.37,"Rain, Partially cloudy",Partly cloudy throughout the day with rain.,rain,"48647099999,48650099999,WMSA,WMKK"
kuala lumpur,5/16/2019,33,24.1,28.4,39.4,24.1,32.2,24.4,80.3,9.771,100,8.33,rain,,,,12.8,277.8,1011.3,58.8,9.8,229.5,19.8,8,,2019-05-16T07:01:44,2019-05-16T19:17:29,0.4,"Rain, Partially cloudy",Partly cloudy throughout the day with rain clearing later.,rain,"48647099999,48650099999,WMSA,WMKK"
kuala lumpur,5/17/2019,32.9,26,29.2,39.1,26,33.3,24.2,75.6,0,0,0,,,,,14.1,301.8,1010.9,57.3,9.7,153.2,13.2,5,,2019-05-17T07:01:41,2019-05-17T19:17:34,0.44,Partially cloudy,Partly cloudy throughout the day.,partly-cloudy-day,"48647099999,48650099999,WMSA,WMKK"
kuala lumpur,5/18/2019,34,26,29.8,41,26,34.7,24.6,75.1,0.116,100,4.17,rain,,,,17.1,297.1,1009.9,57.4,9.9,221.3,19.1,8,,2019-05-18T07:01:40,2019-05-18T19:17:40,0.47,"Rain, Partially cloudy",Partly cloudy throughout the day with late afternoon rain.,rain,"48647099999,48650099999,WMSA,WMKK"
kuala lumpur,5/19/2019,32,25.9,29,38.9,25.9,33.9,24.8,79.1,0.348,100,4.17,rain,,,,14.3,221.5,1010.2,57.3,9.7,173.8,14.9,6,,2019-05-19T07:01:38,2019-05-19T19:17:46,0.5,"Rain, Partially cloudy",Partly cloudy throughout the day with afternoon rain.,rain,"48647099999,48650099999,WMSA,WMKK"
kuala lumpur,5/20/2019,33.9,25.1,28.1,41.6,25.1,31.1,24.9,84.6,39.806,100,4.17,rain,,,,30.9,209.6,1010.7,59.2,8,157.2,13.7,5,,2019-05-20T07:01:38,2019-05-20T19:17:52,0.54,"Rain, Partially cloudy",Partly cloudy throughout the day with late afternoon rain.,rain,"48647099999,48650099999,WMSA,WMKK"
kuala lumpur,5/21/2019,31.9,25,27.3,40,25,29.8,25.1,88.7,5,100,8.33,rain,,,,16.1,240.2,1010.3,57.7,8.3,194.2,16.9,7,,2019-05-21T07:01:38,2019-05-21T19:17:59,0.57,"Rain, Partially cloudy",Partly cloudy throughout the day with rain.,rain,"48647099999,48650099999,WMSA,WMKK"
kuala lumpur,5/22/2019,31.1,24.3,26.3,39.1,24.3,27.7,24.7,91.4,48.623,100,8.33,rain,,,44.6,16.1,193.6,1010.7,57.6,6.2,201.8,17.6,7,,2019-05-22T07:01:39,2019-05-22T19:18:06,0.61,"Rain, Partially cloudy",Partly cloudy throughout the day with rain.,rain,"48647099999,48650099999,WMSA,WMKK"
kuala lumpur,5/23/2019,33.8,24.9,28,41.7,24.9,31.9,25.1,85.3,0.93,100,8.33,rain,,,,12.5,173.2,1010.8,59,7.5,193.3,16.7,7,,2019-05-23T07:01:40,2019-05-23T19:18:14,0.64,"Rain, Partially cloudy",Partly cloudy throughout the day with rain.,rain,"48647099999,48650099999,WMSA,WMKK"
kuala lumpur,5/24/2019,33.9,25,28,40.8,25,30.7,25,85.3,42.435,100,4.17,rain,,,,24.2,163.4,1010,57.8,6.8,173.5,15,6,,2019-05-24T07:01:42,2019-05-24T19:18:22,0.67,"Rain, Partially cloudy",Partly cloudy throughout the day with late afternoon rain.,rain,"48647099999,48650099999,WMSA,WMKK"
kuala lumpur,5/25/2019,33,25.1,29.1,40.4,25.1,33,24.9,79.7,0,0,0,,,,,14.3,187,1009.3,57,8,244.4,21.1,8,,2019-05-25T07:01:45,2019-05-25T19:18:31,0.7,Partially cloudy,Partly cloudy throughout the day.,partly-cloudy-day,"48647099999,48650099999,WMSA,WMKK"
kuala lumpur,5/26/2019,32.9,25.9,28.9,41.5,25.9,34.1,25.2,80.7,0,0,0,,,,,14.3,150.8,1008.8,57.3,9.3,182.7,16,6,,2019-05-26T07:01:48,2019-05-26T19:18:40,0.73,Partially cloudy,Partly cloudy throughout the day.,partly-cloudy-day,"48647099999,48650099999,WMSA,WMKK"
kuala lumpur,5/27/2019,34,26,29.1,41.6,26,33.5,25,79.8,0,0,0,,,,,16.4,156.5,1008,57.3,9,161.7,13.9,6,,2019-05-27T07:01:51,2019-05-27T19:18:49,0.75,Partially cloudy,Partly cloudy throughout the day.,partly-cloudy-day,"48647099999,48650099999,WMSA,WMKK"
kuala lumpur,5/28/2019,34.9,26,29.8,42.1,26,35.1,24.9,76.4,0,0,0,,,,,22.4,148.2,1007.2,58.8,9.6,193.8,16.9,7,,2019-05-28T07:01:56,2019-05-28T19:18:59,0.8,Partially cloudy,Partly cloudy throughout the day.,partly-cloudy-day,"48647099999,48650099999,WMSA,WMKK"
kuala lumpur,5/29/2019,33.8,24.9,29.2,40.6,24.9,34.5,25.2,80.2,0,0,0,,,,37.1,17.7,293.9,1007.5,58.2,8.7,191.5,16.6,7,,2019-05-29T07:02:00,2019-05-29T19:19:09,0.83,Partially cloudy,Partly cloudy throughout the day.,partly-cloudy-day,"48647099999,48650099999,WMSA,WMKK"
kuala lumpur,5/30/2019,32.9,25,27.7,40.3,25,31.2,25.1,86.6,47.319,100,8.33,rain,,,,10.5,154.6,1008.1,57.1,8.9,163.6,14.1,6,,2019-05-30T07:02:06,2019-05-30T19:19:20,0.86,"Rain, Partially cloudy",Partly cloudy throughout the day with rain.,rain,"48647099999,48650099999,WMSA,WMKK"
kuala lumpur,5/31/2019,33.6,25.7,28.5,40.2,25.7,31.9,25.2,83.3,2.498,100,8.33,rain,,,,12.5,170.5,1007.6,57.3,8.1,259.9,22.4,9,,2019-05-31T07:02:12,2019-05-31T19:19:31,0.9,"Rain, Partially cloudy",Partly cloudy throughout the day with rain.,rain,"48647099999,48650099999,WMSA,WMKK"
kuala lumpur,6/1/2019,32.1,25.1,27.2,40.4,25.1,29.2,25.2,89.4,50.415,100,8.33,rain,,,,14.3,230.5,1008.6,58.2,7.9,161.3,13.8,6,,2019-06-01T07:02:18,2019-06-01T19:19:42,0.93,"Rain, Partially cloudy",Partly cloudy throughout the day with rain.,rain,"48647099999,48650099999,WMSA,WMKK"
kuala lumpur,6/2/2019,32,25,27.7,40.5,25,31.2,25.3,87.3,5.304,100,4.17,rain,,,,14.3,270.5,1008.9,57.4,6.4,230.6,19.9,8,,2019-06-02T07:02:25,2019-06-02T19:19:53,0.96,"Rain, Partially cloudy",Partly cloudy throughout the day with late afternoon rain.,rain,"48647099999,48650099999,WMSA,WMKK"
kuala lumpur,6/3/2019,30,26,27.1,37.3,26,30.2,25.5,91.3,6.533,100,12.5,rain,,,,9.4,30.1,1009.1,57.8,7.6,249.8,21.5,9,,2019-06-03T07:02:32,2019-06-03T19:20:05,0,"Rain, Partially cloudy",Partly cloudy throughout the day with rain.,rain,"48647099999,48650099999,WMSA,WMKK"
kuala lumpur,6/4/2019,33.8,25.9,28.1,41.8,25.9,31.1,25,84.3,0.907,100,8.33,rain,,,,17.5,220.3,1008.2,58.3,7.8,203.9,17.5,7,,2019-06-04T07:02:40,2019-06-04T19:20:17,0.03,"Rain, Partially cloudy",Partly cloudy throughout the day with rain.,rain,"48647099999,48650099999,WMSA,WMKK"
kuala lumpur,6/5/2019,31,25,27.3,38.7,25,30.1,25.1,88.7,7.072,100,4.17,rain,,,,14.1,227.7,1008.4,57.3,7.9,116.4,10.1,4,,2019-06-05T07:02:49,2019-06-05T19:20:29,0.06,"Rain, Partially cloudy",Partly cloudy throughout the day with early morning rain.,rain,"48647099999,48650099999,WMSA,WMKK"
kuala lumpur,6/6/2019,29.3,24,26.5,35.1,24,28.1,24.8,90.8,8.757,100,12.5,rain,,,,10.7,175.3,1009.6,57.3,8.8,203.1,17.5,7,,2019-06-06T07:02:57,2019-06-06T19:20:42,0.1,"Rain, Partially cloudy",Partly cloudy throughout the day with rain.,rain,"48647099999,48650099999,WMSA,WMKK"
kuala lumpur,6/7/2019,32,24,27.6,39.2,24,30.9,24.3,83.9,13.899,100,4.17,rain,,,,12.5,143.9,1010.5,58.5,9.2,199.1,17.2,7,,2019-06-07T07:03:07,2019-06-07T19:20:55,0.13,"Rain, Partially cloudy",Partly cloudy throughout the day with early morning rain.,rain,"48647099999,48650099999,WMSA,WMKK"
kuala lumpur,6/8/2019,32.9,26,28.7,39.1,26,32.9,25,81.5,0.177,100,4.17,rain,,,,14.8,150.2,1010.2,57.3,9.1,207.9,18,8,,2019-06-08T07:03:16,2019-06-08T19:21:07,0.17,"Rain, Partially cloudy",Partly cloudy throughout the day with morning rain.,rain,"48647099999,48650099999,WMSA,WMKK"
kuala lumpur,6/9/2019,32.1,26,28.8,39.2,26,33.2,24.9,80.2,0.116,100,4.17,rain,,,,11.2,163,1009.8,57.2,8.9,189.2,16.2,7,,2019-06-09T07:03:26,2019-06-09T19:21:20,0.21,"Rain, Partially cloudy",Partly cloudy throughout the day with morning rain.,rain,"48647099999,48650099999,WMSA,WMKK"
kuala lumpur,6/10/2019,33.9,26.9,30,42,29.9,35.7,24.8,74.4,0,0,0,,,,,16.4,152.3,1008.2,58.7,9.5,194,16.8,7,,2019-06-10T07:03:37,2019-06-10T19:21:34,0.25,Partially cloudy,Partly cloudy throughout the day.,partly-cloudy-day,"48647099999,48650099999,WMSA,WMKK"
kuala lumpur,6/11/2019,33,26,28,40.6,26,31.9,25.1,84.7,5.162,100,8.33,rain,,,,17.7,146.6,1009.7,57.4,9.4,148.7,12.7,5,,2019-06-11T07:03:47,2019-06-11T19:21:47,0.28,"Rain, Partially cloudy",Partly cloudy throughout the day with rain.,rain,"48647099999,48650099999,WMSA,WMKK"
kuala lumpur,6/12/2019,32.8,25.9,28.6,40.3,25.9,32.5,24.7,80.4,0,0,0,,,,,19.6,152.7,1009.9,58.8,9.7,174.8,15.1,6,,2019-06-12T07:03:58,2019-06-12T19:22:00,0.31,Partially cloudy,Partly cloudy throughout the day.,partly-cloudy-day,"48647099999,48650099999,WMSA,WMKK"
kuala lumpur,6/13/2019,32.8,25.1,29.3,39.1,25.1,33.2,23.8,73.1,0,0,0,,,,,17.7,144.8,1009.9,57.8,10,146,12.6,5,,2019-06-13T07:04:09,2019-06-13T19:22:14,0.35,Partially cloudy,Partly cloudy throughout the day.,partly-cloudy-day,"48647099999,48650099999,WMSA,WMKK"
kuala lumpur,6/14/2019,33.7,25.2,29.7,41.5,25.2,34.5,24.2,73.3,1.739,100,4.17,rain,,,,15.3,157.9,1009.5,57.4,10.1,226.9,19.5,8,,2019-06-14T07:04:21,2019-06-14T19:22:27,0.39,"Rain, Partially cloudy",Partly cloudy throughout the day with afternoon rain.,rain,"48647099999,48650099999,WMSA,WMKK"
kuala lumpur,6/15/2019,32.8,23.1,27.9,38.9,23.1,30.9,23.6,79.4,16.218,100,8.33,rain,,,46.4,25.5,209.5,1010.6,58.3,9.3,157.6,13.7,6,,2019-06-15T07:04:33,2019-06-15T19:22:41,0.42,"Rain, Partially cloudy",Partly cloudy throughout the day with rain clearing later.,rain,"48647099999,48650099999,WMSA,WMKK"
kuala lumpur,6/16/2019,33.8,25,29.2,40.6,25,33.7,24.7,77.5,0,0,0,,,,,15.5,166.6,1009.7,57.9,10,197.4,17.1,7,,2019-06-16T07:04:45,2019-06-16T19:22:54,0.46,Partially cloudy,Partly cloudy throughout the day.,partly-cloudy-day,"48647099999,48650099999,WMSA,WMKK"
kuala lumpur,6/17/2019,32.9,24.9,29.3,40.4,24.9,33.9,24.3,75,0,0,0,,,,,14.6,152.9,1009.8,58.6,10.1,162.3,14.1,5,,2019-06-17T07:04:57,2019-06-17T19:23:07,0.5,Partially cloudy,Partly cloudy throughout the day.,partly-cloudy-day,"48647099999,48650099999,WMSA,WMKK"
kuala lumpur,6/18/2019,31.8,25,28.7,38.9,25,33,24.6,79,0.58,100,4.17,rain,,,,15.5,147.2,1010.1,57.4,10,107.3,9.2,4,,2019-06-18T07:05:10,2019-06-18T19:23:21,0.53,"Rain, Partially cloudy",Partly cloudy throughout the day with early morning rain.,rain,"48647099999,48650099999,WMSA,WMKK"
kuala lumpur,6/19/2019,32.8,27,29.6,40.4,30.6,35,24.8,76.4,0,0,0,,,,,16.1,142.6,1009,58.6,9.9,147.5,12.7,5,,2019-06-19T07:05:22,2019-06-19T19:23:34,0.56,Partially cloudy,Partly cloudy throughout the day.,partly-cloudy-day,"48647099999,48650099999,WMSA,WMKK"
kuala lumpur,6/20/2019,32,26.2,28.5,39.6,26.2,33,25.3,83.6,10,100,8.33,rain,,,,14.3,149.4,1009.2,58.6,9.1,155.5,13.4,6,,2019-06-20T07:05:35,2019-06-20T19:23:48,0.59,"Rain, Partially cloudy",Partly cloudy throughout the day with rain.,rain,"48647099999,48650099999,WMSA,WMKK"
kuala lumpur,6/21/2019,31.8,25.1,27.8,40.2,25.1,31.2,25.1,85.6,0,0,0,,,,,12.3,182.9,1008.8,57.8,9.7,188.8,16.4,8,,2019-06-21T07:05:48,2019-06-21T19:24:01,0.62,Partially cloudy,Partly cloudy throughout the day.,partly-cloudy-day,"48647099999,48650099999,WMSA,WMKK"
kuala lumpur,6/22/2019,32.5,24,27.5,38.8,24,30.3,24.3,83.8,2.046,100,8.33,rain,,,,18.1,306.5,1008.4,57.6,8.7,214.2,18.5,8,,2019-06-22T07:06:01,2019-06-22T19:24:14,0.66,"Rain, Partially cloudy",Partly cloudy throughout the day with rain in the morning and afternoon.,rain,"48647099999,48650099999,WMSA,WMKK"
kuala lumpur,6/23/2019,31.8,25.9,28,38.9,25.9,32,25.2,85,4.159,100,4.17,rain,,,,13.9,199.9,1008.1,58.2,8.8,170.1,14.7,7,,2019-06-23T07:06:14,2019-06-23T19:24:27,0.69,"Rain, Partially cloudy",Partly cloudy throughout the day with afternoon rain.,rain,"48647099999,48650099999,WMSA,WMKK"
kuala lumpur,6/24/2019,32.9,26,29.5,38.1,26,33.3,23.9,73.2,0,0,0,,,,,21.4,154.1,1009.1,56.6,10.2,173.3,15,6,,2019-06-24T07:06:27,2019-06-24T19:24:39,0.72,Partially cloudy,Partly cloudy throughout the day.,partly-cloudy-day,"48647099999,48650099999,WMSA,WMKK"
kuala lumpur,6/25/2019,33.8,27,30,42,30.2,35.8,24.8,74.5,0,0,0,,,,,20.1,148.5,1009.9,58.7,9.8,197,17,7,,2019-06-25T07:06:41,2019-06-25T19:24:52,0.75,Partially cloudy,Partly cloudy throughout the day.,partly-cloudy-day,"48647099999,48650099999,WMSA,WMKK"
kuala lumpur,6/26/2019,32.8,22.9,28.1,37.6,22.9,31.1,23,75.2,5.58,100,4.17,rain,,,57.6,33.9,240.6,1010.9,57.6,9.5,213.7,18.3,8,,2019-06-26T07:06:54,2019-06-26T19:25:04,0.79,"Rain, Partially cloudy",Partly cloudy throughout the day with morning rain.,rain,"48647099999,48650099999,WMSA,WMKK"
kuala lumpur,6/27/2019,33.8,25,29.1,40.4,25,33,24.2,76.3,0,0,0,,,,,13,162.8,1009.8,57.7,9.4,186.6,16.1,7,,2019-06-27T07:07:07,2019-06-27T19:25:16,0.82,Partially cloudy,Partly cloudy throughout the day.,partly-cloudy-day,"48647099999,48650099999,WMSA,WMKK"
kuala lumpur,6/28/2019,31.1,25.3,28.4,39.3,25.3,33.4,25.4,84.1,17.913,100,8.33,rain,,,,16.6,146.1,1009.1,57.3,9,165.3,14.4,6,,2019-06-28T07:07:20,2019-06-28T19:25:27,0.85,"Rain, Partially cloudy",Partly cloudy throughout the day with rain in the morning and afternoon.,rain,"48647099999,48650099999,WMSA,WMKK"
kuala lumpur,6/29/2019,31,25.9,28.2,37.9,25.9,33,25.5,85.3,0.884,100,4.17,rain,,,,13.2,132.6,1008.7,57.1,9.7,157.4,13.6,6,,2019-06-29T07:07:33,2019-06-29T19:25:39,0.88,"Rain, Partially cloudy",Partly cloudy throughout the day with late afternoon rain.,rain,"48647099999,48650099999,WMSA,WMKK"
kuala lumpur,6/30/2019,32.9,25,29.1,40.4,25,33.7,24.6,77.8,0,0,0,,,,,16.4,150.6,1009,56.6,9.4,168.8,14.6,6,,2019-06-30T07:07:46,2019-06-30T19:25:50,0.91,Partially cloudy,Partly cloudy throughout the day.,partly-cloudy-day,"48647099999,48650099999,WMSA,WMKK"
kuala lumpur,7/1/2019,32.8,26,29.3,40.3,26,34.4,25.1,78.8,0,0,0,,,,,17.7,161.7,1009.2,56.7,9.8,152.5,13.1,6,,2019-07-01T07:07:59,2019-07-01T19:26:01,0.95,Partially cloudy,Partly cloudy throughout the day.,partly-cloudy-day,"48647099999,48650099999,WMSA,WMKK"
kuala lumpur,7/2/2019,33,25.9,29.4,39.3,25.9,33.9,24.1,74.2,0,0,0,,,,,16.4,152.6,1009.2,57.2,10.1,159.3,13.7,6,,2019-07-02T07:08:12,2019-07-02T19:26:11,0.98,Partially cloudy,Partly cloudy throughout the day.,partly-cloudy-day,"48647099999,48650099999,WMSA,WMKK"
kuala lumpur,7/3/2019,32.6,25.9,28.6,39.1,25.9,33,24.4,78.6,0.046,100,4.17,rain,,,,13.9,154.7,1009.8,57.1,8.2,113.6,9.8,4,,2019-07-03T07:08:24,2019-07-03T19:26:21,0,"Rain, Partially cloudy",Partly cloudy throughout the day with morning rain.,rain,"48647099999,48650099999,WMSA,WMKK"
kuala lumpur,7/4/2019,32.9,25.9,29.1,39.3,25.9,33,24.4,77.2,1.58,100,8.33,rain,,,,14.3,149.2,1010.2,56.7,8.9,147.4,12.7,5,,2019-07-04T07:08:36,2019-07-04T19:26:30,0.05,"Rain, Partially cloudy",Partly cloudy throughout the day with rain.,rain,"48647099999,48650099999,WMSA,WMKK"
kuala lumpur,7/5/2019,33.9,26.7,29.2,40.6,29.8,33.6,24.1,75.2,0,0,0,,,,,17.5,148.2,1008.8,58.2,9.3,166.6,14.3,6,,2019-07-05T07:08:49,2019-07-05T19:26:40,0.08,Partially cloudy,Partly cloudy throughout the day.,partly-cloudy-day,"48647099999,48650099999,WMSA,WMKK"
kuala lumpur,7/6/2019,32.8,24.2,27.8,41.1,24.2,30.9,24.5,83.2,61,100,4.17,rain,,,31.7,15.9,166.6,1009.1,57.7,7.8,209.7,18,8,,2019-07-06T07:09:01,2019-07-06T19:26:48,0.12,"Rain, Partially cloudy",Partly cloudy throughout the day with late afternoon rain.,rain,"48647099999,48650099999,WMSA,WMKK"
kuala lumpur,7/7/2019,31.8,24.8,27.3,38.7,24.8,29.8,24.4,84.7,6.539,100,8.33,rain,,,,8.9,187.3,1010.6,57.8,8.8,119.2,10.1,5,,2019-07-07T07:09:12,2019-07-07T19:26:56,0.15,"Rain, Partially cloudy",Partly cloudy throughout the day with rain.,rain,"48647099999,48650099999,WMSA,WMKK"
kuala lumpur,7/8/2019,32.9,25,28.1,40.3,25,30.8,24.6,82.8,1.768,100,4.17,rain,,,,15.7,154.9,1011,55.7,9.3,142,12.3,5,,2019-07-08T07:09:24,2019-07-08T19:27:04,0.19,"Rain, Partially cloudy",Partly cloudy throughout the day with late afternoon rain.,rain,"48647099999,48650099999,WMSA,WMKK"
kuala lumpur,7/9/2019,32.7,24,27.8,38.9,24,30.8,24.1,81.3,0,0,0,,,,,15.7,154.1,1011.6,58.9,9.6,130.3,11.4,5,,2019-07-09T07:09:35,2019-07-09T19:27:11,0.25,Partially cloudy,Partly cloudy throughout the day.,partly-cloudy-day,"48647099999,48650099999,WMSA,WMKK"
kuala lumpur,7/10/2019,33.6,25.8,29,39.7,25.8,32.4,23.9,75.2,0,0,0,,,,35.3,17.7,151.5,1009.9,58.3,10,214,18.5,7,,2019-07-10T07:09:46,2019-07-10T19:27:18,0.26,Partially cloudy,Partly cloudy throughout the day.,partly-cloudy-day,"48647099999,48650099999,WMSA,WMKK"
kuala lumpur,7/11/2019,33.6,25.2,29.4,39.9,25.2,33.1,23.9,73.6,0,0,0,,,,,17.5,157.4,1011.1,57.2,9.9,242.7,20.9,8,,2019-07-11T07:09:56,2019-07-11T19:27:24,0.3,Partially cloudy,Partly cloudy throughout the day.,partly-cloudy-day,"48647099999,48650099999,WMSA,WMKK"
kuala lumpur,7/12/2019,32.8,26.7,29.5,38.9,29.5,33.5,23.4,70.6,0,0,0,,,,,20.1,154.4,1011.4,57.6,10.2,242,21,8,,2019-07-12T07:10:06,2019-07-12T19:27:30,0.33,Partially cloudy,Partly cloudy throughout the day.,partly-cloudy-day,"48647099999,48650099999,WMSA,WMKK"
kuala lumpur,7/13/2019,32,25.8,28.8,38.7,25.8,32.8,24.3,77.2,0,0,0,,,,,14.8,148.4,1010.8,57,9.3,183.4,15.8,6,,2019-07-13T07:10:16,2019-07-13T19:27:35,0.37,Partially cloudy,Partly cloudy throughout the day.,partly-cloudy-day,"48647099999,48650099999,WMSA,WMKK"
kuala lumpur,7/14/2019,31.9,25.7,27.1,37.9,25.7,28.8,24.5,86.3,31.826,100,8.33,rain,,,,19,187,1010.1,57.9,7,190.9,16.5,7,,2019-07-14T07:10:26,2019-07-14T19:27:40,0.4,"Rain, Partially cloudy",Partly cloudy throughout the day with rain.,rain,"48647099999,48650099999,WMSA,WMKK"
kuala lumpur,7/15/2019,32.6,24.1,27.8,38.6,24.1,30.8,24.1,81.3,0,0,0,,,,,10.5,282.1,1009.5,57.2,8.3,170.3,14.8,6,,2019-07-15T07:10:35,2019-07-15T19:27:44,0.44,Partially cloudy,Partly cloudy throughout the day.,partly-cloudy-day,"48647099999,48650099999,WMSA,WMKK"
kuala lumpur,7/16/2019,31.8,25.9,27.9,37.7,25.9,30.9,24.8,84.2,1.768,100,4.17,rain,,,,19.6,153.4,1009.3,56.9,8.4,175.1,15.3,6,,2019-07-16T07:10:44,2019-07-16T19:27:47,0.47,"Rain, Partially cloudy",Partly cloudy throughout the day with late afternoon rain.,rain,"48647099999,48650099999,WMSA,WMKK"
kuala lumpur,7/17/2019,32,25,28.4,39,25,31.6,24.2,79.3,0.093,100,4.17,rain,,,,21.4,157.6,1008.1,58.5,7.9,180.4,15.5,6,,2019-07-17T07:10:52,2019-07-17T19:27:50,0.5,"Rain, Partially cloudy",Partly cloudy throughout the day with afternoon rain.,rain,"48647099999,48650099999,WMSA,WMKK"
kuala lumpur,7/18/2019,31.9,26,28.9,37.5,26,32.6,24,75.6,0,0,0,,,,,19.9,146,1007.2,58.2,9.2,236.1,20.3,8,,2019-07-18T07:11:00,2019-07-18T19:27:52,0.54,Partially cloudy,Partly cloudy throughout the day.,partly-cloudy-day,"48647099999,48650099999,WMSA,WMKK"
kuala lumpur,7/19/2019,32.8,25.9,29.2,37.6,25.9,32.7,23.3,71.2,0,0,0,,,,,20.1,146.4,1007.9,57.7,10.1,254.3,22.1,8,,2019-07-19T07:11:07,2019-07-19T19:27:53,0.57,Partially cloudy,Partly cloudy throughout the day.,partly-cloudy-day,"48647099999,48650099999,WMSA,WMKK"
kuala lumpur,7/20/2019,33.8,26,29.5,40.3,26,33.3,23.4,70.6,0,0,0,,,,,17.9,150.7,1008.2,57.3,10.1,268,23.3,9,,2019-07-20T07:11:14,2019-07-20T19:27:54,0.61,Partially cloudy,Partly cloudy throughout the day.,partly-cloudy-day,"48647099999,48650099999,WMSA,WMKK"
kuala lumpur,7/21/2019,32.8,25.3,27.9,39.9,25.3,30.9,24.4,81.8,13.261,100,4.17,rain,,,,15.7,165.4,1008.8,58.3,8.8,220.8,19,7,,2019-07-21T07:11:20,2019-07-21T19:27:54,0.64,"Rain, Partially cloudy",Partly cloudy throughout the day with late afternoon rain.,rain,"48647099999,48650099999,WMSA,WMKK"
kuala lumpur,7/22/2019,30.1,24.2,26.5,35.7,24.2,28.2,24,86.4,4.249,100,8.33,rain,,,,16.1,163.6,1009,57.3,8.1,210.7,18.1,8,,2019-07-22T07:11:26,2019-07-22T19:27:54,0.67,"Rain, Partially cloudy",Partly cloudy throughout the day with rain.,rain,"48647099999,48650099999,WMSA,WMKK"
kuala lumpur,7/23/2019,32.8,25.8,28.5,37.2,25.8,31,23.8,77.1,0,0,0,,,,,14.1,151.2,1009.5,57.7,10,195.3,17,7,,2019-07-23T07:11:32,2019-07-23T19:27:53,0.71,Partially cloudy,Partly cloudy throughout the day.,partly-cloudy-day,"48647099999,48650099999,WMSA,WMKK"
kuala lumpur,7/24/2019,31,25.9,27.6,37.7,25.9,30.8,24.4,83.1,3.768,100,8.33,rain,,,,17.7,151.8,1010.8,57.3,9.8,168.9,14.4,6,,2019-07-24T07:11:37,2019-07-24T19:27:51,0.74,"Rain, Partially cloudy",Partly cloudy throughout the day with rain.,rain,"48647099999,48650099999,WMSA,WMKK"
kuala lumpur,7/25/2019,31.9,24.7,26.6,39,24.7,27.9,24.2,87.1,8.91,100,12.5,rain,,,50,25.6,260.9,1011.5,57.1,9.3,168.8,14.7,6,,2019-07-25T07:11:41,2019-07-25T19:27:49,0.75,"Rain, Partially cloudy",Partly cloudy throughout the day with rain.,rain,"48647099999,48650099999,WMSA,WMKK"
kuala lumpur,7/26/2019,33.8,24.1,28.4,39.2,24.1,31,23.3,76.1,0,0,0,,,,,16.9,159.7,1010.5,57.5,8.3,173.3,14.9,6,,2019-07-26T07:11:45,2019-07-26T19:27:46,0.8,Partially cloudy,Partly cloudy throughout the day.,partly-cloudy-day,"48647099999,48650099999,WMSA,WMKK"
kuala lumpur,7/27/2019,32,26,28.7,38.1,26,32.8,24.2,77.2,0,0,0,,,,,14.6,193,1010,57.1,8.7,160.2,13.8,5,,2019-07-27T07:11:49,2019-07-27T19:27:42,0.84,Partially cloudy,Partly cloudy throughout the day.,partly-cloudy-day,"48647099999,48650099999,WMSA,WMKK"
kuala lumpur,7/28/2019,33,25,29.1,40.3,25,33.1,24.3,76.8,0,0,0,,,,,12.5,191.6,1010.5,57.3,8.7,186.4,15.9,7,,2019-07-28T07:11:51,2019-07-28T19:27:38,0.87,Partially cloudy,Partly cloudy throughout the day.,partly-cloudy-day,"48647099999,48650099999,WMSA,WMKK"
kuala lumpur,7/29/2019,32.9,25.9,29.4,39.7,25.9,33.9,24.5,75.6,0,0,0,,,,,17.7,174.2,1010.8,56.9,9.7,197.3,17.2,7,,2019-07-29T07:11:54,2019-07-29T19:27:32,0.9,Partially cloudy,Partly cloudy throughout the day.,partly-cloudy-day,"48647099999,48650099999,WMSA,WMKK"
kuala lumpur,7/30/2019,32.9,25,29,40.1,25,33.3,24.1,75.5,0.07,100,4.17,rain,,,,15.3,275.7,1010.5,58.3,9.5,186.3,16.1,7,,2019-07-30T07:11:56,2019-07-30T19:27:27,0.94,"Rain, Partially cloudy",Partly cloudy throughout the day with morning rain.,rain,"48647099999,48650099999,WMSA,WMKK"
kuala lumpur,7/31/2019,32.8,25.7,28.6,38.9,25.7,32,24.2,78.1,1.044,100,4.17,rain,,,,19.9,206.7,1010.3,57.4,7.6,169.4,14.6,6,,2019-07-31T07:11:57,2019-07-31T19:27:20,0.97,"Rain, Partially cloudy",Partly cloudy throughout the day with afternoon rain.,rain,"48647099999,48650099999,WMSA,WMKK"
kuala lumpur,8/1/2019,32.9,25,28.2,37.7,25,31.1,23.8,78.3,0.232,100,4.17,rain,,,,21.7,179.6,1010.9,57.1,6.6,193.3,16.7,7,,2019-08-01T07:11:58,2019-08-01T19:27:13,0,"Rain, Partially cloudy",Partly cloudy throughout the day with afternoon rain.,rain,"48647099999,48650099999,WMSA,WMKK"
kuala lumpur,8/2/2019,31.9,22.9,27.7,37.8,22.9,30.9,23.6,79.3,0.812,100,4.17,rain,,,,18.8,196.3,1010.8,60.6,8.3,243.4,21,8,,2019-08-02T07:11:58,2019-08-02T19:27:05,0.04,"Rain, Partially cloudy",Partly cloudy throughout the day with morning rain.,rain,"48647099999,48650099999,WMSA,WMKK"
kuala lumpur,8/3/2019,31.8,26,28,37.6,26,31.3,24.2,80.6,3.536,100,4.17,rain,,,,14.8,146.2,1010.3,57.3,7.5,190.6,16.6,7,,2019-08-03T07:11:58,2019-08-03T19:26:57,0.07,"Rain, Partially cloudy",Partly cloudy throughout the day with afternoon rain.,rain,"48647099999,48650099999,WMSA,WMKK"
kuala lumpur,8/4/2019,32.8,24,28.5,39.1,24,31.9,24.1,78.2,0,0,0,,,,,19.9,166.1,1009.5,58.7,8.3,224.7,19.2,8,,2019-08-04T07:11:57,2019-08-04T19:26:48,0.11,Partially cloudy,Partly cloudy throughout the day.,partly-cloudy-day,"48647099999,48650099999,WMSA,WMKK"
kuala lumpur,8/5/2019,32.9,25.2,28.9,39.1,25.2,32.8,24.2,76.8,0,0,0,,,,,23.2,161.9,1008.8,58.9,8.1,203.1,17.6,7,,2019-08-05T07:11:55,2019-08-05T19:26:38,0.14,Partially cloudy,Partly cloudy throughout the day.,partly-cloudy-day,"48647099999,48650099999,WMSA,WMKK"
kuala lumpur,8/6/2019,32.9,25.9,29.2,40.3,25.9,33.4,24.3,76.3,0,0,0,,,,,16.6,164.8,1008.6,57.6,8,220.6,19,8,,2019-08-06T07:11:53,2019-08-06T19:26:28,0.17,Partially cloudy,Partly cloudy throughout the day.,partly-cloudy-day,"48647099999,48650099999,WMSA,WMKK"
kuala lumpur,8/7/2019,31.9,25.1,28.5,39,25.1,32.5,24.7,80.5,0.247,100,8.33,rain,,,,14.6,191.1,1008.5,57.4,6.3,151.9,13.3,6,,2019-08-07T07:11:51,2019-08-07T19:26:17,0.21,"Rain, Partially cloudy",Partly cloudy throughout the day with rain.,rain,"48647099999,48650099999,WMSA,WMKK"
kuala lumpur,8/8/2019,31.9,25.1,28.6,39,25.1,32.4,24.6,80,0,0,0,,,,,16.6,166.7,1008.6,57.3,7,194.8,16.9,7,,2019-08-08T07:11:48,2019-08-08T19:26:05,0.25,Partially cloudy,Partly cloudy throughout the day.,partly-cloudy-day,"48647099999,48650099999,WMSA,WMKK"
kuala lumpur,8/9/2019,32,26.7,29.3,38.3,29.9,34.2,24.5,76,0,0,0,,,,,17.7,158.8,1008.6,58.4,7.7,167.8,14.7,6,,2019-08-09T07:11:44,2019-08-09T19:25:53,0.28,Partially cloudy,Partly cloudy throughout the day.,partly-cloudy-day,"48647099999,48650099999,WMSA,WMKK"
kuala lumpur,8/10/2019,31.1,24,27.9,36.7,24,31.4,24.1,80.4,0,0,0,,,,48.2,20.4,156.9,1008.7,59.6,7.3,222.4,19.2,8,,2019-08-10T07:11:40,2019-08-10T19:25:40,0.31,Partially cloudy,Partly cloudy throughout the day.,partly-cloudy-day,"48647099999,48650099999,WMSA,WMKK"
kuala lumpur,8/11/2019,32.7,26,28.7,38.9,26,32.4,24.6,79.8,7.956,100,4.17,rain,,,,19.9,150.8,1008.6,57.3,6.8,199.6,17.2,7,,2019-08-11T07:11:35,2019-08-11T19:25:26,0.35,"Rain, Partially cloudy",Partly cloudy throughout the day with afternoon rain.,rain,"48647099999,48650099999,WMSA,WMKK"
kuala lumpur,8/12/2019,33.8,25.8,29.4,41.5,25.8,33.4,24,73.7,0.348,100,4.17,rain,,,,21.2,145.7,1009.1,56.4,9.3,263.5,22.8,9,,2019-08-12T07:11:30,2019-08-12T19:25:12,0.38,"Rain, Partially cloudy",Partly cloudy throughout the day with afternoon rain.,rain,"48647099999,48650099999,WMSA,WMKK"
kuala lumpur,8/13/2019,33.9,26,29.9,40.4,26,34.7,24.3,73,0,0,0,,,,,14.3,173.3,1009.7,57,9.4,212.5,18.2,7,,2019-08-13T07:11:24,2019-08-13T19:24:57,0.42,Partially cloudy,Partly cloudy throughout the day.,partly-cloudy-day,"48647099999,48650099999,WMSA,WMKK"
kuala lumpur,8/14/2019,31.9,25.8,27.8,40.3,25.8,31.2,25,85.3,12.377,100,4.17,rain,,,,19.2,167.8,1010.8,58.4,7.5,151.2,13.1,6,,2019-08-14T07:11:18,2019-08-14T19:24:42,0.45,"Rain, Partially cloudy",Partly cloudy throughout the day with late afternoon rain.,rain,"48647099999,48650099999,WMSA,WMKK"
kuala lumpur,8/15/2019,31.8,24.2,26.7,40.1,24.2,28.8,24.5,88.6,44.479,100,12.5,rain,,,38.9,17.5,181.7,1011.7,58.3,7.8,153.7,13.3,5,,2019-08-15T07:11:11,2019-08-15T19:24:26,0.5,"Rain, Partially cloudy",Partly cloudy throughout the day with rain.,rain,"48647099999,48650099999,WMSA,WMKK"
kuala lumpur,8/16/2019,31.9,24,27.7,38.7,24,30.9,24.1,82.2,0,0,0,,,,,21.7,152.5,1011,57.7,8.4,232.1,20.1,8,,2019-08-16T07:11:04,2019-08-16T19:24:09,0.52,Partially cloudy,Partly cloudy throughout the day.,partly-cloudy-day,"48647099999,48650099999,WMSA,WMKK"
kuala lumpur,8/17/2019,34.4,25.8,29,41.1,25.8,33,24.5,77.7,0,0,0,,,,,18.2,140.8,1010.4,57.3,7.9,145.7,12.6,6,,2019-08-17T07:10:57,2019-08-17T19:23:52,0.56,Partially cloudy,Partly cloudy throughout the day.,partly-cloudy-day,"48647099999,48650099999,WMSA,WMKK"
kuala lumpur,8/18/2019,33.9,25.3,28.1,40.6,25.3,30.6,23.9,79.1,15.913,100,4.17,rain,,,,14.6,139.3,1010.7,57.4,7.9,183.5,15.9,7,,2019-08-18T07:10:48,2019-08-18T19:23:34,0.59,"Rain, Partially cloudy",Partly cloudy throughout the day with late afternoon rain.,rain,"48647099999,48650099999,WMSA,WMKK"
kuala lumpur,8/19/2019,32.9,25,28.4,39.1,25,31.6,24.1,79,0,0,0,,,,,16.4,164.4,1010.9,56.8,7.5,270.9,23.3,9,,2019-08-19T07:10:40,2019-08-19T19:23:16,0.62,Partially cloudy,Partly cloudy throughout the day.,partly-cloudy-day,"48647099999,48650099999,WMSA,WMKK"
kuala lumpur,8/20/2019,32.9,26,29.4,40.3,26,33.6,24.2,74.4,0,0,0,,,,,14.3,171.1,1009.2,56.9,7.6,243.1,20.9,8,,2019-08-20T07:10:31,2019-08-20T19:22:57,0.66,Partially cloudy,Partly cloudy throughout the day.,partly-cloudy-day,"48647099999,48650099999,WMSA,WMKK"
kuala lumpur,8/21/2019,31.8,25.8,27.8,37.6,25.8,31,24.3,82.2,4.066,100,8.33,rain,,,,15.9,294.8,1010,58.2,7.7,237.2,20.6,8,,2019-08-21T07:10:21,2019-08-21T19:22:38,0.69,"Rain, Partially cloudy",Partly cloudy throughout the day with rain.,rain,"48647099999,48650099999,WMSA,WMKK"
kuala lumpur,8/22/2019,32.8,24.1,27.5,40.1,24.1,30.3,24.1,83.2,1.768,100,4.17,rain,,,,13.7,216.7,1010.7,57.6,8.1,191.6,16.6,7,,2019-08-22T07:10:11,2019-08-22T19:22:19,0.72,"Rain, Partially cloudy",Partly cloudy throughout the day with late afternoon rain.,rain,"48647099999,48650099999,WMSA,WMKK"
kuala lumpur,8/23/2019,32.8,25,28.5,41.6,25,32,24.6,80.4,0.116,100,4.17,rain,,,,19.6,163,1010.8,57.2,7.3,240.6,20.9,8,,2019-08-23T07:10:01,2019-08-23T19:21:58,0.75,"Rain, Partially cloudy",Partly cloudy throughout the day with afternoon rain.,rain,"48647099999,48650099999,WMSA,WMKK"
kuala lumpur,8/24/2019,33,26,28.6,37.3,26,32.2,24.3,78.7,0,0,0,,,,,14.6,185.5,1010.5,57.3,9.6,236.6,20.5,8,,2019-08-24T07:09:50,2019-08-24T19:21:38,0.79,Partially cloudy,Partly cloudy throughout the day.,partly-cloudy-day,"48647099999,48650099999,WMSA,WMKK"
kuala lumpur,8/25/2019,32,24.9,27.9,37.8,24.9,31.2,24.4,82.1,0.707,100,4.17,rain,,,,14.6,284.6,1010.9,58.3,8.1,128.2,10.9,5,,2019-08-25T07:09:39,2019-08-25T19:21:17,0.82,"Rain, Partially cloudy",Partly cloudy throughout the day with afternoon rain.,rain,"48647099999,48650099999,WMSA,WMKK"
kuala lumpur,8/26/2019,32.5,25,28.2,38.9,25,31.7,24.4,80.8,0,0,0,,,,,15.5,209.8,1010,58.2,8.9,180.9,15.7,7,,2019-08-26T07:09:27,2019-08-26T19:20:55,0.86,Partially cloudy,Partly cloudy throughout the day.,partly-cloudy-day,"48647099999,48650099999,WMSA,WMKK"
kuala lumpur,8/27/2019,32.1,25.8,27.8,39.3,25.8,31.6,24.5,82.7,7.956,100,4.17,rain,,,,10,284.3,1009.9,58.4,8.3,162.4,14.1,5,,2019-08-27T07:09:15,2019-08-27T19:20:33,0.89,"Rain, Partially cloudy",Partly cloudy throughout the day with late afternoon rain.,rain,"48647099999,48650099999,WMSA,WMKK"
kuala lumpur,8/28/2019,32.4,25,27.3,39.8,25,29.3,24.2,84.2,0.177,100,4.17,rain,,,,12.5,338.5,1010.6,57.2,9.4,200.4,17.1,7,,2019-08-28T07:09:03,2019-08-28T19:20:11,0.92,"Rain, Partially cloudy",Partly cloudy throughout the day with early morning rain.,rain,"48647099999,48650099999,WMSA,WMKK"
kuala lumpur,8/29/2019,32.9,24.1,28.4,38.8,24.1,31.6,23.8,77.1,0,0,0,,,,,19.9,152.6,1009.5,59.4,9.7,194.7,17,7,,2019-08-29T07:08:50,2019-08-29T19:19:48,0.96,Partially cloudy,Partly cloudy throughout the day.,partly-cloudy-day,"48647099999,48650099999,WMSA,WMKK"
kuala lumpur,8/30/2019,33.7,25.6,29,38.7,25.6,31.8,22.9,71,0,0,0,,,,,23.2,149.2,1008.4,56.3,9.3,178,15.3,6,,2019-08-30T07:08:37,2019-08-30T19:19:25,0,Partially cloudy,Partly cloudy throughout the day.,partly-cloudy-day,"48647099999,48650099999,WMSA,WMKK"
kuala lumpur,8/31/2019,33.8,24.2,28.9,38,24.2,31.4,22.4,69.3,0,0,0,,,,,21.2,151.3,1008.3,59,9.9,280.3,24.3,10,,2019-08-31T07:08:24,2019-08-31T19:19:02,0.02,Partially cloudy,Partly cloudy throughout the day.,partly-cloudy-day,"48647099999,48650099999,WMSA,WMKK"
kuala lumpur,9/1/2019,34.8,24,29.3,38.2,24,31.7,21.6,64.5,0,0,0,,,,,17.7,154,1009.7,55.2,9.7,266.5,23,9,,2019-09-01T07:08:10,2019-09-01T19:18:38,0.06,Partially cloudy,Partly cloudy throughout the day.,partly-cloudy-day,"48647099999,48650099999,WMSA,WMKK"
kuala lumpur,9/2/2019,34.8,25,29.3,39.5,25,32.7,23.3,71.2,0,0,0,,,,,17.7,184.7,1009.5,56.9,9,121.6,10.5,5,,2019-09-02T07:07:56,2019-09-02T19:18:14,0.09,Partially cloudy,Partly cloudy throughout the day.,partly-cloudy-day,"48647099999,48650099999,WMSA,WMKK"
kuala lumpur,9/3/2019,32.8,27,28.9,40.3,30.3,33.8,24.6,78.2,0,0,0,,,,,15.9,213.2,1009.3,57.3,7.4,151.4,13.1,6,,2019-09-03T07:07:42,2019-09-03T19:17:49,0.13,Partially cloudy,Partly cloudy throughout the day.,partly-cloudy-day,"48647099999,48650099999,WMSA,WMKK"
kuala lumpur,9/4/2019,31.9,23,27.8,38.9,23,31.9,24.5,83,0,0,0,,,,46.4,26.4,167.9,1010.2,58.1,7.7,139.2,12,6,,2019-09-04T07:07:28,2019-09-04T19:17:25,0.16,Partially cloudy,Partly cloudy throughout the day.,partly-cloudy-day,"48647099999,48650099999,WMSA,WMKK"
kuala lumpur,9/5/2019,32.9,26,29.3,41.4,26,34,25,78.9,0.177,100,4.17,rain,,,,18.2,141.8,1010,58,7.8,166.7,14.4,6,,2019-09-05T07:07:13,2019-09-05T19:17:00,0.19,"Rain, Partially cloudy",Partly cloudy throughout the day with early morning rain.,rain,"48647099999,48650099999,WMSA,WMKK"
kuala lumpur,9/6/2019,33.9,26.8,30.1,41.5,29.6,35.3,24.5,73,0,0,0,,,,,14.6,159.1,1009.5,56,6.4,204.3,17.6,7,,2019-09-06T07:06:58,2019-09-06T19:16:35,0.25,Partially cloudy,Partly cloudy throughout the day.,partly-cloudy-day,"48647099999,48650099999,WMSA,WMKK"
kuala lumpur,9/7/2019,33.9,26.1,29.2,41.8,26.1,34.7,25.2,79.6,6.188,100,4.17,rain,,,,16.1,148.2,1009.9,57.4,6.5,238.5,20.6,8,,2019-09-07T07:06:43,2019-09-07T19:16:09,0.26,"Rain, Partially cloudy",Partly cloudy throughout the day with late afternoon rain.,rain,"48647099999,48650099999,WMSA,WMKK"
kuala lumpur,9/8/2019,33,26.9,29.2,40.4,30.3,34.7,25.2,79.9,0,0,0,,,,,15.2,151.9,1010.9,59.4,4.6,243.2,21,8,,2019-09-08T07:06:28,2019-09-08T19:15:44,0.3,Partially cloudy,Partly cloudy throughout the day.,partly-cloudy-day,"48647099999,48650099999,WMSA,WMKK"
kuala lumpur,9/9/2019,31.7,26.1,29.2,39.9,26.1,34.6,25,78.4,0,0,0,,,,,14.6,204.1,1010.9,57.7,6.5,172.1,14.9,6,,2019-09-09T07:06:12,2019-09-09T19:15:18,0.33,Partially cloudy,Partly cloudy throughout the day.,partly-cloudy-day,"48647099999,48650099999,WMSA,WMKK"
kuala lumpur,9/10/2019,33.9,26.8,30,41.6,29.7,35.5,24.7,74.6,0,0,0,,,,,16.1,174.4,1010.9,57.7,3.9,145.1,12.6,5,,2019-09-10T07:05:56,2019-09-10T19:14:52,0.36,Partially cloudy,Partly cloudy throughout the day.,partly-cloudy-day,"48647099999,48650099999,WMSA,WMKK"
kuala lumpur,9/11/2019,34,26.8,30.4,40.6,29.6,35.6,24.3,71.3,0,0,0,,,,,16.1,152.5,1011.7,57.3,3.5,201.7,17.6,7,,2019-09-11T07:05:41,2019-09-11T19:14:26,0.4,Partially cloudy,Partly cloudy throughout the day.,partly-cloudy-day,"48647099999,48650099999,WMSA,WMKK"
kuala lumpur,9/12/2019,33.9,26.5,29.5,41,26.5,33.8,24.1,73.6,0,0,0,,,,,16.1,210.5,1012.4,58.7,4,218.9,19,8,,2019-09-12T07:05:25,2019-09-12T19:14:00,0.43,Partially cloudy,Partly cloudy throughout the day.,partly-cloudy-day,"48647099999,48650099999,WMSA,WMKK"
kuala lumpur,9/13/2019,32,25.9,28.5,39,25.9,32.4,24.5,79.2,0,0,0,,,,,15.7,277,1011.9,63.1,2.5,135.7,11.8,5,,2019-09-13T07:05:09,2019-09-13T19:13:33,0.47,Partially cloudy,Partly cloudy throughout the day.,partly-cloudy-day,"48647099999,48650099999,WMSA,WMKK"
kuala lumpur,9/14/2019,31,24.7,27.6,38.5,24.7,31.1,24.3,82.4,12.925,100,12.5,rain,,,,12.1,270.5,1011.2,57.1,6.2,113.2,9.7,4,,2019-09-14T07:04:53,2019-09-14T19:13:07,0.5,"Rain, Partially cloudy",Partly cloudy throughout the day with rain.,rain,"48647099999,48650099999,WMSA,WMKK"
kuala lumpur,9/15/2019,32.8,25.1,28.7,39,25.1,32.3,24.5,79.4,0,0,0,,,,,12.3,206.6,1009.9,59.8,5.2,195.5,16.9,8,,2019-09-15T07:04:36,2019-09-15T19:12:41,0.53,Partially cloudy,Partly cloudy throughout the day.,partly-cloudy-day,"48647099999,48650099999,WMSA,WMKK"
kuala lumpur,9/16/2019,31.7,25.8,27.8,38.5,25.8,30.8,24.4,81.9,0,0,0,,,,,14.6,157.1,1009.4,58.8,3.1,141.2,12.2,5,,2019-09-16T07:04:20,2019-09-16T19:12:14,0.57,Partially cloudy,Partly cloudy throughout the day.,partly-cloudy-day,"48647099999,48650099999,WMSA,WMKK"
kuala lumpur,9/17/2019,31.9,24,28.3,38.6,24,31.2,23.6,77.3,0,0,0,,,,,18.2,161.8,1009.8,57.8,2.8,187.2,16.2,6,,2019-09-17T07:04:04,2019-09-17T19:11:48,0.6,Partially cloudy,Partly cloudy throughout the day.,partly-cloudy-day,"48647099999,48650099999,WMSA,WMKK"
kuala lumpur,9/18/2019,32.9,26,28.2,40.4,26,32,24.5,80.7,0.177,100,4.17,rain,,,,20.1,140.9,1010.5,55.5,2.6,161.6,13.9,6,,2019-09-18T07:03:48,2019-09-18T19:11:21,0.64,"Rain, Partially cloudy",Partly cloudy throughout the day with late afternoon rain.,rain,"48647099999,48650099999,WMSA,WMKK"
kuala lumpur,9/19/2019,33.9,26,29.3,41.8,26,34.3,25,78.5,0,0,0,,,,,17.7,163,1010.4,57.4,2.7,192.9,16.7,7,,2019-09-19T07:03:31,2019-09-19T19:10:54,0.67,Partially cloudy,Partly cloudy throughout the day.,partly-cloudy-day,"48647099999,48650099999,WMSA,WMKK"
kuala lumpur,9/20/2019,33.1,25.1,28.9,40.8,25.1,33,24.6,78.2,0,0,0,,,,,17.1,258.9,1010.3,58.3,3.7,223.1,19.3,8,,2019-09-20T07:03:15,2019-09-20T19:10:28,0.7,Partially cloudy,Partly cloudy throughout the day.,partly-cloudy-day,"48647099999,48650099999,WMSA,WMKK"
kuala lumpur,9/21/2019,33.9,25.1,29.1,40.1,25.1,32,23.4,73.1,0,0,0,,,,,17.9,153,1009.8,50.6,3.6,219.8,19.2,8,,2019-09-21T07:02:59,2019-09-21T19:10:01,0.74,Partially cloudy,Partly cloudy throughout the day.,partly-cloudy-day,"48647099999,48650099999,WMSA,WMKK"
kuala lumpur,9/22/2019,34.7,24.8,29.2,38.4,24.8,32,22.5,69.1,0,0,0,,,,,17.9,140.1,1010,57.4,3.2,248.5,21.5,9,,2019-09-22T07:02:43,2019-09-22T19:09:35,0.75,Partially cloudy,Partly cloudy throughout the day.,partly-cloudy-day,"48647099999,48650099999,WMSA,WMKK"
kuala lumpur,9/23/2019,34.8,24.1,29.1,41.4,24.1,32.6,23.3,71.9,0,0,0,,,,,14.1,78.3,1010.7,57.2,4.4,201.5,17.6,8,,2019-09-23T07:02:27,2019-09-23T19:09:09,0.81,Partially cloudy,Partly cloudy throughout the day.,partly-cloudy-day,"48647099999,48650099999,WMSA,WMKK"
kuala lumpur,9/24/2019,34.7,26,29,40.5,26,32.7,23.9,75.8,2.348,100,4.17,rain,,,42.5,13.5,65.2,1010.3,57.5,5.2,206.8,18,7,,2019-09-24T07:02:11,2019-09-24T19:08:42,0.84,"Rain, Partially cloudy",Partly cloudy throughout the day with late afternoon rain.,rain,"48647099999,48650099999,WMSA,WMKK"
kuala lumpur,9/25/2019,33,24.9,26.9,39.3,24.9,28.5,24.1,85.5,38.71,100,8.33,rain,,,50,16.1,157.6,1011.2,57.3,7.4,172.3,14.9,6,,2019-09-25T07:01:55,2019-09-25T19:08:16,0.88,"Rain, Partially cloudy",Partly cloudy throughout the day with rain.,rain,"48647099999,48650099999,WMSA,WMKK"
kuala lumpur,9/26/2019,32.8,24.9,27.3,40.1,24.9,29.9,24.4,85.4,1.855,100,4.17,rain,,,,15.5,298.9,1012.3,48.5,8.5,252.1,21.7,9,,2019-09-26T07:01:40,2019-09-26T19:07:51,0.91,"Rain, Partially cloudy",Partly cloudy throughout the day with late afternoon rain.,rain,"48647099999,48650099999,WMSA,WMKK"
kuala lumpur,9/27/2019,32.9,24.9,27.2,38.8,24.9,29.2,24.3,85.4,19.121,100,8.33,rain,,,,12.5,296.5,1012.2,41.7,8.1,233.3,20.2,8,,2019-09-27T07:01:24,2019-09-27T19:07:25,0.95,"Rain, Partially cloudy",Partly cloudy throughout the day with rain.,rain,"48647099999,48650099999,WMSA,WMKK"
kuala lumpur,9/28/2019,33,24,27.3,39.1,24,29.6,24.1,84.2,1.884,100,8.33,rain,,,,17.3,274.6,1011.6,40.3,6.5,261.4,22.7,9,,2019-09-28T07:01:09,2019-09-28T19:06:59,0.98,"Rain, Partially cloudy",Partly cloudy throughout the day with rain.,rain,"48647099999,48650099999,WMSA,WMKK"
kuala lumpur,9/29/2019,32.1,24.1,26.5,37.9,24.1,28.1,24.5,89,43,100,12.5,rain,,,,12.5,248.9,1011.9,41.3,8.7,207.8,17.8,8,,2019-09-29T07:00:54,2019-09-29T19:06:34,0,"Rain, Partially cloudy",Partly cloudy throughout the day with rain.,rain,"48647099999,48650099999,WMSA,WMKK"
kuala lumpur,9/30/2019,30.9,24,26.4,36.6,24,28.2,24.2,88.4,2.513,100,8.33,rain,,,,19.9,234.5,1011.9,39.5,9.2,172.3,15,6,,2019-09-30T07:00:39,2019-09-30T19:06:09,0.05,"Rain, Partially cloudy",Partly cloudy throughout the day with rain.,rain,"48647099999,48650099999,WMSA,WMKK"
kuala lumpur,10/1/2019,32.9,24,26.7,38.1,24,28.2,23.9,86.1,10.171,100,8.33,rain,,,,29.5,256,1011.6,42.4,6.6,223.9,19.2,9,,2019-10-01T07:00:24,2019-10-01T19:05:44,0.08,"Rain, Partially cloudy",Partly cloudy throughout the day with rain.,rain,"48647099999,48650099999,WMSA,WMKK"
kuala lumpur,10/2/2019,32.9,23.1,27.1,38.4,23.1,29,23.7,83.3,15.052,100,8.33,rain,,,37.1,12.8,161.1,1011.7,38.5,5.3,253.8,21.7,9,,2019-10-02T07:00:10,2019-10-02T19:05:20,0.11,"Rain, Partially cloudy",Partly cloudy throughout the day with rain.,rain,"48647099999,48650099999,WMSA,WMKK"
kuala lumpur,10/3/2019,31,24,26.6,36.5,24,28.3,24.1,87,10.655,100,12.5,rain,,,,17.5,288,1011.7,40.2,5.6,226.8,19.5,8,,2019-10-03T06:59:56,2019-10-03T19:04:55,0.15,"Rain, Partially cloudy",Partly cloudy throughout the day with rain.,rain,"48647099999,48650099999,WMSA,WMKK"
kuala lumpur,10/4/2019,32.7,23.9,27.5,37.8,23.9,29.8,23.7,81.5,0.07,100,4.17,rain,,,,17.3,155.6,1011.2,39.9,7.5,222.5,19.2,7,,2019-10-04T06:59:42,2019-10-04T19:04:32,0.18,"Rain, Partially cloudy",Partly cloudy throughout the day with afternoon rain.,rain,"48647099999,48650099999,WMSA,WMKK"
kuala lumpur,10/5/2019,33.7,24,27.5,38,24,29.2,23.6,81.2,25.284,100,8.33,rain,,,,19.6,261.8,1009.8,42.2,8.7,255.9,22.1,9,,2019-10-05T06:59:28,2019-10-05T19:04:08,0.21,"Rain, Partially cloudy",Partly cloudy throughout the day with rain.,rain,"48647099999,48650099999,WMSA,WMKK"
kuala lumpur,10/6/2019,32.9,25.8,27.8,37.8,25.8,29.9,23.7,79.6,0.07,100,4.17,rain,,,,11.4,284.5,1010.2,40.5,8.8,279.6,24.1,10,,2019-10-06T06:59:15,2019-10-06T19:03:45,0.25,"Rain, Partially cloudy",Partly cloudy throughout the day with morning rain.,rain,"48647099999,48650099999,WMSA,WMKK"
kuala lumpur,10/7/2019,32,25,26.7,37.8,25,27.9,24.1,86.4,6.783,100,8.33,rain,,,,13.9,26.5,1010.2,43.3,8.2,199.9,17.1,8,,2019-10-07T06:59:02,2019-10-07T19:03:22,0.28,"Rain, Partially cloudy",Partly cloudy throughout the day with rain.,rain,"48647099999,48650099999,WMSA,WMKK"
kuala lumpur,10/8/2019,31.8,24,26.5,38.6,24,28.4,24.1,87.6,28.313,100,8.33,rain,,,,14.1,178.2,1010.3,42.1,7.1,259.3,22.4,9,,2019-10-08T06:58:50,2019-10-08T19:03:00,0.31,"Rain, Partially cloudy",Partly cloudy throughout the day with rain.,rain,"48647099999,48650099999,WMSA,WMKK"
kuala lumpur,10/9/2019,32,23.1,26.1,37.8,23.1,27.5,23.8,88.2,59.301,100,12.5,rain,,,,26.7,281.2,1010.7,40.7,7.2,248.2,21.5,9,,2019-10-09T06:58:38,2019-10-09T19:02:38,0.34,"Rain, Partially cloudy",Partly cloudy throughout the day with rain.,rain,"48647099999,48650099999,WMSA,WMKK"
kuala lumpur,10/10/2019,32.9,23.8,27.1,39.1,23.8,29.3,24.1,85.2,15.608,100,8.33,rain,,,,15.5,295.2,1010.8,41,7.8,268.9,23.2,9,,2019-10-10T06:58:26,2019-10-10T19:02:17,0.38,"Rain, Partially cloudy",Partly cloudy throughout the day with rain.,rain,"48647099999,48650099999,WMSA,WMKK"
kuala lumpur,10/11/2019,33.9,25,27.5,40.1,25,29.3,23.9,82.2,26.545,100,8.33,rain,,,,19.2,252.9,1010.3,40.1,7.3,268.4,23.1,10,,2019-10-11T06:58:15,2019-10-11T19:01:56,0.41,"Rain, Partially cloudy",Partly cloudy throughout the day with rain.,rain,"48647099999,48650099999,WMSA,WMKK"
kuala lumpur,10/12/2019,33.2,24.1,27.1,39.7,24.1,29.2,24.2,85.1,5.05,100,12.5,rain,,,,15.3,275,1009.6,39.9,7.3,230.8,20,8,,2019-10-12T06:58:04,2019-10-12T19:01:35,0.44,"Rain, Partially cloudy",Partly cloudy throughout the day with rain.,rain,"48647099999,48650099999,WMSA,WMKK"
kuala lumpur,10/13/2019,30,25.3,27.1,35.6,25.3,29.3,24.5,86,0.994,100,8.33,rain,,,,14.1,311.2,1009.9,40.1,7.3,141.2,12.2,5,,2019-10-13T06:57:54,2019-10-13T19:01:15,0.48,"Rain, Partially cloudy",Partly cloudy throughout the day with rain.,rain,"48647099999,48650099999,WMSA,WMKK"
kuala lumpur,10/14/2019,32.9,23.7,27.1,40.2,23.7,29.1,24,84.2,32.71,100,4.17,rain,,,38.9,15.5,160.1,1010.3,39.9,7.4,207.6,17.9,8,,2019-10-14T06:57:44,2019-10-14T19:00:56,0.5,"Rain, Partially cloudy",Partly cloudy throughout the day with late afternoon rain.,rain,"48647099999,48650099999,WMSA,WMKK"
kuala lumpur,10/15/2019,32.9,24.8,27.3,40.1,24.8,29.2,24.1,84,23.869,100,4.17,rain,,,,15.9,300.2,1010.1,41.7,6.2,220.9,19.1,8,,2019-10-15T06:57:35,2019-10-15T19:00:37,0.55,"Rain, Partially cloudy",Partly cloudy throughout the day with late afternoon rain.,rain,"48647099999,48650099999,WMSA,WMKK"
kuala lumpur,10/16/2019,33.8,24.1,27.7,39.2,24.1,30.8,24.3,83,1.884,100,8.33,rain,,,,14.1,297.5,1009.4,39,7.7,218.8,18.8,7,,2019-10-16T06:57:27,2019-10-16T19:00:19,0.58,"Rain, Partially cloudy",Partly cloudy throughout the day with rain.,rain,"48647099999,48650099999,WMSA,WMKK"
kuala lumpur,10/17/2019,32.9,24.7,27.4,41.6,24.7,30.3,25,87.5,60.087,100,8.33,rain,,,33.5,21.7,302.9,1009.3,40.5,6.8,194.5,16.9,8,,2019-10-17T06:57:18,2019-10-17T19:00:01,0.62,"Rain, Partially cloudy",Partly cloudy throughout the day with rain.,rain,"48647099999,48650099999,WMSA,WMKK"
kuala lumpur,10/18/2019,31,24.8,26.8,37.8,24.8,29.3,25,90.7,24.724,100,12.5,rain,,,,11,304.5,1010.1,40.4,7.4,127.8,11,5,,2019-10-18T06:57:11,2019-10-18T18:59:44,0.65,"Rain, Partially cloudy",Partly cloudy throughout the day with rain.,rain,"48647099999,48650099999,WMSA,WMKK"
kuala lumpur,10/19/2019,32.9,25,27.1,40.6,25,29.1,24.7,88.1,38.24,100,8.33,rain,,,,14.6,98.6,1010,39.2,9,222.6,19.2,9,,2019-10-19T06:57:04,2019-10-19T18:59:27,0.69,"Rain, Partially cloudy",Partly cloudy throughout the day with rain.,rain,"48647099999,48650099999,WMSA,WMKK"
kuala lumpur,10/20/2019,33.7,24,27.9,40.4,24,30.9,24.4,83.1,3.437,100,12.5,rain,,,,23.8,161.9,1009.4,39.2,8.4,234.8,20.3,9,,2019-10-20T06:56:57,2019-10-20T18:59:12,0.72,"Rain, Partially cloudy",Partly cloudy throughout the day with rain.,rain,"48647099999,48650099999,WMSA,WMKK"
kuala lumpur,10/21/2019,32.8,24.9,27.7,41.9,24.9,30.8,24.9,85.8,4.067,100,8.33,rain,,,,12.5,258.3,1008.8,40.1,7.3,219.1,18.9,8,,2019-10-21T06:56:52,2019-10-21T18:58:56,0.75,"Rain, Partially cloudy",Partly cloudy throughout the day with rain.,rain,"48647099999,48650099999,WMSA,WMKK"
kuala lumpur,10/22/2019,31.1,24.8,27,38.4,24.8,29.5,24.7,87.8,20.116,100,8.33,rain,,,,18.8,312.3,1008.9,39.8,7.9,159.8,13.9,5,,2019-10-22T06:56:46,2019-10-22T18:58:42,0.79,"Rain, Partially cloudy",Partly cloudy throughout the day with rain.,rain,"48647099999,48650099999,WMSA,WMKK"
kuala lumpur,10/23/2019,33.7,24,26.9,40.3,24,28.7,24.2,86.6,46.855,100,8.33,rain,,,51.8,30.5,261.4,1008.9,38.3,8.4,212.7,18.4,7,,2019-10-23T06:56:42,2019-10-23T18:58:28,0.83,"Rain, Partially cloudy",Partly cloudy throughout the day with rain.,rain,"48647099999,48650099999,WMSA,WMKK"
kuala lumpur,10/24/2019,33,24.1,27.2,40.6,24.1,29.6,24.4,86,31.119,100,8.33,rain,,,,17.1,295.2,1009.5,39.4,7.7,248.8,21.4,9,,2019-10-24T06:56:38,2019-10-24T18:58:15,0.86,"Rain, Partially cloudy",Partly cloudy throughout the day with rain.,rain,"48647099999,48650099999,WMSA,WMKK"
kuala lumpur,10/25/2019,33.8,23.8,26.9,40.1,23.8,28.9,23.9,85.2,60.942,100,8.33,rain,,,,20.1,316.2,1010.1,38.4,7.6,155.4,13.4,5,,2019-10-25T06:56:35,2019-10-25T18:58:03,0.9,"Rain, Partially cloudy",Partly cloudy throughout the day with rain.,rain,"48647099999,48650099999,WMSA,WMKK"
kuala lumpur,10/26/2019,30.9,24.9,26.4,37.6,24.9,27.8,25,92.7,21.221,100,12.5,rain,,,42.5,21.7,243.9,1009.7,44.5,6.1,87.1,7.5,3,,2019-10-26T06:56:32,2019-10-26T18:57:52,0.93,"Rain, Partially cloudy",Partly cloudy throughout the day with rain.,rain,"48647099999,48650099999,WMSA,WMKK"
kuala lumpur,10/27/2019,32.7,23.9,26.6,38.9,23.9,28.4,24.1,87.4,14.353,100,8.33,rain,,,,12.5,284.3,1009.1,38.4,7.8,182,15.7,7,,2019-10-27T06:56:31,2019-10-27T18:57:41,0.97,"Rain, Partially cloudy",Partly cloudy throughout the day with rain.,rain,"48647099999,48650099999,WMSA,WMKK"
kuala lumpur,10/28/2019,30.1,25,26.3,35.3,25,27.5,24.3,89.6,1.939,100,12.5,rain,,,,8.7,309.6,1009.8,40.2,9.8,240.5,20.9,9,,2019-10-28T06:56:29,2019-10-28T18:57:31,0,"Rain, Partially cloudy",Partly cloudy throughout the day with rain.,rain,"48647099999,48650099999,WMSA,WMKK"
kuala lumpur,10/29/2019,32.9,24,27.2,41.1,24,29.8,24.3,85.3,0.354,100,8.33,rain,,,,16.1,165.5,1009.3,37.6,8.7,231.8,20,8,,2019-10-29T06:56:29,2019-10-29T18:57:22,0.03,"Rain, Partially cloudy",Partly cloudy throughout the day with rain.,rain,"48647099999,48650099999,WMSA,WMKK"
kuala lumpur,10/30/2019,31.9,25.7,27.4,37.9,25.7,29.5,24.4,84.4,0,0,0,,,,,17.3,234.2,1009.2,39.5,7.6,171.8,14.9,7,,2019-10-30T06:56:29,2019-10-30T18:57:14,0.07,Partially cloudy,Partly cloudy throughout the day.,partly-cloudy-day,"48647099999,48650099999,WMSA,WMKK"
kuala lumpur,10/31/2019,32.3,25,28.1,38.6,25,31,24.1,79.9,2.458,100,8.33,rain,,,,19,260,1009,38.6,8.5,133.6,11.4,5,,2019-10-31T06:56:31,2019-10-31T18:57:06,0.1,"Rain, Partially cloudy",Partly cloudy throughout the day with rain.,rain,"48647099999,48650099999,WMSA,WMKK"
kuala lumpur,11/1/2019,32.9,24,28.2,39.2,24,31.4,24.2,80.3,2.652,100,4.17,rain,,,,13.9,304.9,1009.5,42.4,9.8,206.8,17.9,7,,2019-11-01T06:56:32,2019-11-01T18:57:00,0.13,"Rain, Partially cloudy",Partly cloudy throughout the day with early morning rain.,rain,"48647099999,48650099999,WMSA,WMKK"
kuala lumpur,11/2/2019,30.9,25.3,26.9,36.4,25.3,29.2,24.6,87.1,4.42,100,4.17,rain,,,,11,334.4,1009.8,38.5,9.8,193.2,16.7,6,,2019-11-02T06:56:35,2019-11-02T18:56:54,0.16,"Rain, Partially cloudy",Partly cloudy throughout the day with afternoon rain.,rain,"48647099999,48650099999,WMSA,WMKK"
kuala lumpur,11/3/2019,32.9,24.9,28.4,38.1,24.9,31.2,23.7,77.4,0.177,100,4.17,rain,,,,11.2,271.2,1010.8,39.2,9.3,183.8,15.9,7,,2019-11-03T06:56:38,2019-11-03T18:56:49,0.2,"Rain, Partially cloudy",Partly cloudy throughout the day with early morning rain.,rain,"48647099999,48650099999,WMSA,WMKK"
kuala lumpur,11/4/2019,32.5,25.9,28.2,39.6,25.9,32,24.4,80.5,0.023,100,4.17,rain,,,,15.5,324.1,1011.4,39.8,9.5,193.7,17,7,,2019-11-04T06:56:43,2019-11-04T18:56:45,0.25,"Rain, Partially cloudy",Partly cloudy throughout the day with afternoon rain.,rain,"48647099999,48650099999,WMSA,WMKK"
kuala lumpur,11/5/2019,31.9,25,27.9,37.9,25,31.1,24.5,82.7,0.553,100,8.33,rain,,,,13.7,293.9,1010,38.4,9.4,160.8,14,6,,2019-11-05T06:56:48,2019-11-05T18:56:42,0.26,"Rain, Partially cloudy",Partly cloudy throughout the day with rain.,rain,"48647099999,48650099999,WMSA,WMKK"
kuala lumpur,11/6/2019,32,25,28,38.1,25,31.5,24.8,83.4,12.377,100,4.17,rain,,,,14.3,243.1,1008.9,37.7,9.2,209.1,17.9,8,,2019-11-06T06:56:53,2019-11-06T18:56:40,0.29,"Rain, Partially cloudy",Partly cloudy throughout the day with late afternoon rain.,rain,"48647099999,48650099999,WMSA,WMKK"
kuala lumpur,11/7/2019,33.9,25.8,27.6,40.8,25.8,30,24.5,84,18.565,100,4.17,rain,,,,25.8,253.4,1009.4,36.9,5.3,186,16.2,7,,2019-11-07T06:57:00,2019-11-07T18:56:38,0.32,"Rain, Partially cloudy",Partly cloudy throughout the day with late afternoon rain.,rain,"48647099999,48650099999,WMSA,WMKK"
kuala lumpur,11/8/2019,29.7,22.7,25.8,32.8,22.7,26.8,23.2,86.3,106.47,100,8.33,rain,,,,19,306,1012.4,37.3,7.9,175.4,15,6,,2019-11-08T06:57:07,2019-11-08T18:56:38,0.36,"Rain, Partially cloudy",Partly cloudy throughout the day with rain in the morning and afternoon.,rain,"48647099999,48650099999,WMSA,WMKK"
kuala lumpur,11/9/2019,33,24.8,28.1,39.3,24.8,31.2,23.9,78.6,0.354,100,4.17,rain,,,,12.5,310.6,1011.4,37.2,9.4,237.2,20.3,8,,2019-11-09T06:57:15,2019-11-09T18:56:38,0.39,"Rain, Partially cloudy",Partly cloudy throughout the day with late afternoon rain.,rain,"48647099999,48650099999,WMSA,WMKK"
kuala lumpur,11/10/2019,30,25,27.2,36.2,25,30.3,24.9,87.8,0.817,100,4.17,rain,,,,10.7,269.5,1010.5,37.1,9.1,230.2,20,8,,2019-11-10T06:57:24,2019-11-10T18:56:40,0.42,"Rain, Partially cloudy",Partly cloudy throughout the day with afternoon rain.,rain,"48647099999,48650099999,WMSA,WMKK"
kuala lumpur,11/11/2019,30.8,24.6,26.9,36.3,24.6,28.8,24.1,85.3,7.956,100,4.17,rain,,,,12.3,308.2,1009.5,37.4,9.1,208.4,17.9,8,,2019-11-11T06:57:34,2019-11-11T18:56:42,0.45,"Rain, Partially cloudy",Partly cloudy throughout the day with afternoon rain.,rain,"48647099999,48650099999,WMSA,WMKK"
kuala lumpur,11/12/2019,33,24.9,28.2,40.3,24.9,31.5,24.3,80.5,0,0,0,,,,44.6,15.7,310.2,1010.1,38,9,187.6,16.3,7,,2019-11-12T06:57:45,2019-11-12T18:56:45,0.5,Partially cloudy,Partly cloudy throughout the day.,partly-cloudy-day,"48647099999,48650099999,WMSA,WMKK"
kuala lumpur,11/13/2019,32.9,25,28.3,41.8,25,32.2,24.9,82.4,0.464,100,4.17,rain,,,,15.9,299.8,1010.7,37.2,8,161.8,13.9,6,,2019-11-13T06:57:56,2019-11-13T18:56:49,0.52,"Rain, Partially cloudy",Partly cloudy throughout the day with late afternoon rain.,rain,"48647099999,48650099999,WMSA,WMKK"
kuala lumpur,11/14/2019,32.8,25,27.5,40.3,25,30.2,24.9,86.7,31.956,100,4.17,rain,,,42.5,17.5,238.9,1010.3,37.3,6.5,112.5,9.5,4,,2019-11-14T06:58:08,2019-11-14T18:56:54,0.56,"Rain, Partially cloudy",Partly cloudy throughout the day with late afternoon rain.,rain,"48647099999,48650099999,WMSA,WMKK"
kuala lumpur,11/15/2019,31.9,24.2,25.9,39,24.2,26.9,24.2,91.1,13.67,100,12.5,rain,,,,14.3,339.8,1010.6,37.9,6.5,226.3,19.7,8,,2019-11-15T06:58:21,2019-11-15T18:57:00,0.59,"Rain, Partially cloudy",Partly cloudy throughout the day with rain.,rain,"48647099999,48650099999,WMSA,WMKK"
kuala lumpur,11/16/2019,33,24,26.8,40.3,24,28.7,23.9,85.4,2,100,4.17,rain,,,,14.3,180.4,1010.4,39.5,8.1,251.4,21.6,9,,2019-11-16T06:58:35,2019-11-16T18:57:07,0.63,"Rain, Partially cloudy",Partly cloudy throughout the day with late afternoon rain.,rain,"48647099999,48650099999,WMSA,WMKK"
kuala lumpur,11/17/2019,32.8,24,27.2,40.3,24,29.3,24.2,84.9,11.493,100,8.33,rain,,,,15.7,309.2,1010.5,37.7,9,263,22.9,9,,2019-11-17T06:58:49,2019-11-17T18:57:15,0.66,"Rain, Partially cloudy",Partly cloudy throughout the day with rain.,rain,"48647099999,48650099999,WMSA,WMKK"
kuala lumpur,11/18/2019,34,24.1,27.3,40.4,24.1,29.3,24.4,85.6,14.145,100,4.17,rain,,,,15.7,270.7,1010.4,38.1,7.6,220.6,18.9,8,,2019-11-18T06:59:05,2019-11-18T18:57:24,0.7,"Rain, Partially cloudy",Partly cloudy throughout the day with late afternoon rain.,rain,"48647099999,48650099999,WMSA,WMKK"
kuala lumpur,11/19/2019,31,24.2,27,36.5,24.2,29.6,24.4,86.2,2.249,100,8.33,rain,,,,16.9,251.5,1010,37.6,8.7,231.2,20,8,,2019-11-19T06:59:21,2019-11-19T18:57:33,0.73,"Rain, Partially cloudy",Partly cloudy throughout the day with rain.,rain,"48647099999,48650099999,WMSA,WMKK"
kuala lumpur,11/20/2019,33.1,25,27.6,40.6,25,29.6,24.6,84.8,2.884,100,4.17,rain,,,48.2,19.4,245.1,1009.2,39.1,8.5,158,13.6,6,,2019-11-20T06:59:38,2019-11-20T18:57:44,0.75,"Rain, Partially cloudy",Partly cloudy throughout the day with late afternoon rain.,rain,"48647099999,48650099999,WMSA,WMKK"
kuala lumpur,11/21/2019,33,24.9,27.7,37.8,24.9,29.4,23.8,80.7,0.884,100,4.17,rain,,,,15.1,107,1009.7,38.4,7.8,146.9,12.7,5,,2019-11-21T06:59:55,2019-11-21T18:57:55,0.81,"Rain, Partially cloudy",Partly cloudy throughout the day with late afternoon rain.,rain,"48647099999,48650099999,WMSA,WMKK"
kuala lumpur,11/22/2019,32.2,25.8,27.6,38.3,25.8,29.9,24.2,82.8,0.348,100,4.17,rain,,,,12.1,330,1010.5,38,9.4,149.7,12.9,6,,2019-11-22T07:00:13,2019-11-22T18:58:08,0.84,"Rain, Partially cloudy",Partly cloudy throughout the day with late afternoon rain.,rain,"48647099999,48650099999,WMSA,WMKK"
kuala lumpur,11/23/2019,32.9,24.9,27,39.2,24.9,28.9,24.2,85.9,14.652,100,4.17,rain,,,,15.7,323.4,1010.9,38.5,9.2,187.7,16.3,7,,2019-11-23T07:00:32,2019-11-23T18:58:21,0.88,"Rain, Partially cloudy",Partly cloudy throughout the day with late afternoon rain.,rain,"48647099999,48650099999,WMSA,WMKK"
kuala lumpur,11/24/2019,33,24.9,27.7,39.3,24.9,31,24.8,85.1,2.238,100,8.33,rain,,,,11.2,316.7,1010.5,37.7,9.1,234.2,20.2,9,,2019-11-24T07:00:52,2019-11-24T18:58:35,0.91,"Rain, Partially cloudy",Partly cloudy throughout the day with rain.,rain,"48647099999,48650099999,WMSA,WMKK"
kuala lumpur,11/25/2019,31.9,24.9,26.8,39,24.9,28.9,24.4,87.3,9.087,100,4.17,rain,,,,13.9,303,1010.3,41.3,8.9,141.3,12.1,5,,2019-11-25T07:01:13,2019-11-25T18:58:50,0.95,"Rain, Partially cloudy",Partly cloudy throughout the day with late afternoon rain.,rain,"48647099999,48650099999,WMSA,WMKK"
kuala lumpur,11/26/2019,34.9,24,27.8,40.5,24,29.9,24,82.4,11.609,100,4.17,rain,,,35.3,14.1,74,1008.8,37.3,8.4,223.2,19.3,8,,2019-11-26T07:01:34,2019-11-26T18:59:06,0,"Rain, Partially cloudy",Partly cloudy throughout the day with late afternoon rain.,rain,"48647099999,48650099999,WMSA,WMKK"
kuala lumpur,11/27/2019,32,25,27.5,37.9,25,29.8,24.6,85.3,23.915,100,8.33,rain,,,,14.1,294.9,1008.4,39.8,8.9,219.2,18.9,8,,2019-11-27T07:01:55,2019-11-27T18:59:22,0.02,"Rain, Partially cloudy",Partly cloudy throughout the day with rain.,rain,"48647099999,48650099999,WMSA,WMKK"
kuala lumpur,11/28/2019,32,24.8,28,38.2,24.8,30.9,24.4,81.8,0.531,100,8.33,rain,,,29.5,10.5,48,1008.3,39.1,8.5,190,16.3,7,,2019-11-28T07:02:18,2019-11-28T18:59:40,0.05,"Rain, Partially cloudy",Partly cloudy throughout the day with rain.,rain,"48647099999,48650099999,WMSA,WMKK"
kuala lumpur,11/29/2019,32.8,24.1,27.4,40.5,24.1,30,24.6,85.4,7.421,100,4.17,rain,,,,12.5,336.1,1009.1,38.8,8.9,139.8,12.2,5,,2019-11-29T07:02:41,2019-11-29T18:59:58,0.08,"Rain, Partially cloudy",Partly cloudy throughout the day with late afternoon rain.,rain,"48647099999,48650099999,WMSA,WMKK"
kuala lumpur,11/30/2019,32.9,25.7,28.5,40.1,25.7,31.7,24.6,80.7,0,0,0,,,,,10.7,39.9,1009,39,9.2,170.4,14.8,7,,2019-11-30T07:03:04,2019-11-30T19:00:17,0.11,Partially cloudy,Partly cloudy throughout the day.,partly-cloudy-day,"48647099999,48650099999,WMSA,WMKK"
kuala lumpur,12/1/2019,31.9,25.1,27.2,39.1,25.1,29.5,24.8,87.6,49.249,100,8.33,rain,,,,10.5,335.4,1009.1,38.9,7.7,153.8,13.3,6,,2019-12-01T07:03:28,2019-12-01T19:00:36,0.15,"Rain, Partially cloudy",Partly cloudy throughout the day with rain.,rain,"48647099999,48650099999,WMSA,WMKK"
kuala lumpur,12/2/2019,32.7,25,27.4,39.8,25,29.8,24.5,85.5,23.041,100,8.33,rain,,,35.3,16.4,15.5,1009.7,39,8.8,194.6,16.7,7,,2019-12-02T07:03:53,2019-12-02T19:00:57,0.18,"Rain, Partially cloudy",Partly cloudy throughout the day with rain.,rain,"48647099999,48650099999,WMSA,WMKK"
kuala lumpur,12/3/2019,33,25.1,28.8,37.7,25.1,31.1,22.5,70.1,0,0,0,,,,,14.3,49.8,1009.9,37.4,9.9,234.5,20.2,8,,2019-12-03T07:04:18,2019-12-03T19:01:18,0.21,Partially cloudy,Partly cloudy throughout the day.,partly-cloudy-day,"48647099999,48650099999,WMSA,WMKK"
kuala lumpur,12/4/2019,34,25.1,28.5,39.2,25.1,31.3,23,73.4,0.177,100,4.17,rain,,,,16.9,349.1,1010,39.7,9.9,274.3,23.6,10,,2019-12-04T07:04:44,2019-12-04T19:01:40,0.25,"Rain, Partially cloudy",Partly cloudy throughout the day with late afternoon rain.,rain,"48647099999,48650099999,WMSA,WMKK"
kuala lumpur,12/5/2019,33.8,24.2,27.9,38.9,24.2,30.5,23.6,78.4,0.884,100,4.17,rain,,,,11,86.1,1011,38.9,9.3,278.8,24.2,9,,2019-12-05T07:05:10,2019-12-05T19:02:02,0.27,"Rain, Partially cloudy",Partly cloudy throughout the day with late afternoon rain.,rain,"48647099999,48650099999,WMSA,WMKK"
kuala lumpur,12/6/2019,32.9,25,27.9,39.1,25,29.9,23.8,80.5,34.478,100,4.17,rain,,,,15.7,275.2,1010.8,38.3,7.8,275.5,23.8,9,,2019-12-06T07:05:37,2019-12-06T19:02:26,0.31,"Rain, Partially cloudy",Partly cloudy throughout the day with late afternoon rain.,rain,"48647099999,48650099999,WMSA,WMKK"
kuala lumpur,12/7/2019,32.1,24.2,27.6,36.8,24.2,29.9,23.5,79.8,57.464,100,4.17,rain,,,,11.8,51.1,1010.8,39.7,9.2,254.5,22.1,9,,2019-12-07T07:06:04,2019-12-07T19:02:49,0.34,"Rain, Partially cloudy",Partly cloudy throughout the day with early morning rain.,rain,"48647099999,48650099999,WMSA,WMKK"
kuala lumpur,12/8/2019,32,24.3,27.1,37.8,24.3,29.1,24,83.8,24.754,100,8.33,rain,,,,12.8,195.7,1011.5,40.7,8.8,229.7,19.7,9,,2019-12-08T07:06:32,2019-12-08T19:03:14,0.37,"Rain, Partially cloudy",Partly cloudy throughout the day with rain.,rain,"48647099999,48650099999,WMSA,WMKK"
kuala lumpur,12/9/2019,31.7,24,27.6,36.4,24,30.3,23.9,81.6,0,0,0,,,,,10,187.8,1011.2,39.5,9.7,179.5,15.6,6,,2019-12-09T07:06:59,2019-12-09T19:03:39,0.4,Partially cloudy,Partly cloudy throughout the day.,partly-cloudy-day,"48647099999,48650099999,WMSA,WMKK"
kuala lumpur,12/10/2019,32.7,25.1,27.6,38.9,25.1,29.8,24,81.6,1.768,100,4.17,rain,,,,10.7,334.7,1010.3,39.5,9.8,214.3,18.5,8,,2019-12-10T07:07:28,2019-12-10T19:04:04,0.43,"Rain, Partially cloudy",Partly cloudy throughout the day with late afternoon rain.,rain,"48647099999,48650099999,WMSA,WMKK"
kuala lumpur,12/11/2019,32.7,24,26.7,40.3,24,28.4,24,86.1,23.754,100,8.33,rain,,,35.3,16.1,354.4,1010,38.8,9.5,181.3,15.7,6,,2019-12-11T07:07:56,2019-12-11T19:04:30,0.47,"Rain, Partially cloudy",Partly cloudy throughout the day with rain.,rain,"48647099999,48650099999,WMSA,WMKK"
kuala lumpur,12/12/2019,33.9,24.1,27.8,40.1,24.1,30.8,24.2,82.1,0,0,0,,,,,12.3,53.5,1010.1,39.1,9.2,203.1,17.6,7,,2019-12-12T07:08:25,2019-12-12T19:04:57,0.5,Partially cloudy,Partly cloudy throughout the day.,partly-cloudy-day,"48647099999,48650099999,WMSA,WMKK"
kuala lumpur,12/13/2019,33.2,23.1,27.8,37.9,23.1,30.3,23.5,79.1,12.023,100,8.33,rain,,,,13.7,12.3,1010.9,37.3,9.4,255.4,22.1,9,,2019-12-13T07:08:54,2019-12-13T19:05:24,0.53,"Rain, Partially cloudy",Partly cloudy throughout the day with rain.,rain,"48647099999,48650099999,WMSA,WMKK"
kuala lumpur,12/14/2019,27,23.9,25.3,30.4,23.9,26,23.7,91,11.342,100,12.5,rain,,,,8,61.1,1011.5,39.8,9.2,107.4,9.3,4,,2019-12-14T07:09:23,2019-12-14T19:05:51,0.57,"Rain, Partially cloudy",Partly cloudy throughout the day with rain.,rain,"48647099999,48650099999,WMSA,WMKK"
kuala lumpur,12/15/2019,27.8,23.1,24.8,31.6,23.1,25.4,23.7,94.2,29.754,100,8.33,rain,,,,7.8,266.6,1010.7,38.6,7,91.7,7.8,3,,2019-12-15T07:09:53,2019-12-15T19:06:19,0.61,"Rain, Partially cloudy",Partly cloudy throughout the day with rain.,rain,"48647099999,48650099999,WMSA,WMKK"
kuala lumpur,12/16/2019,28.2,23.7,25.8,33,23.7,27.5,24.3,91.6,0.908,100,12.5,rain,,,,8.7,341.9,1010,37.3,8.6,222,19.2,8,,2019-12-16T07:10:22,2019-12-16T19:06:47,0.64,"Rain, Partially cloudy",Partly cloudy throughout the day with rain.,rain,"48647099999,48650099999,WMSA,WMKK"
kuala lumpur,12/17/2019,31.9,24.2,26.8,38.9,24.2,29,24.7,89.2,4.391,100,4.17,rain,,,,12.5,314.3,1010,38.5,8.1,137.4,11.9,5,,2019-12-17T07:10:52,2019-12-17T19:07:16,0.68,"Rain, Partially cloudy",Partly cloudy throughout the day with late afternoon rain.,rain,"48647099999,48650099999,WMSA,WMKK"
kuala lumpur,12/18/2019,29.9,25,26.6,36.9,25,28.5,24.8,90.6,9.017,100,12.5,rain,,,,10.5,295.3,1010.9,38.8,9,97.1,8.3,4,,2019-12-18T07:11:22,2019-12-18T19:07:45,0.71,"Rain, Partially cloudy",Partly cloudy throughout the day with rain.,rain,"48647099999,48650099999,WMSA,WMKK"
kuala lumpur,12/19/2019,33.7,24.9,27.1,41.5,24.9,29.3,24.8,88.2,1.768,100,4.17,rain,,,,20.8,304.4,1010.3,38.9,8.2,201.5,17.4,7,,2019-12-19T07:11:52,2019-12-19T19:08:14,0.75,"Rain, Partially cloudy",Partly cloudy throughout the day with late afternoon rain.,rain,"48647099999,48650099999,WMSA,WMKK"
kuala lumpur,12/20/2019,34,24.9,28.1,41.6,24.9,31.2,24.4,81.8,0,0,0,,,,37.1,16.6,43.8,1009.2,37.7,8.8,234.8,20.4,8,,2019-12-20T07:12:22,2019-12-20T19:08:43,0.78,Partially cloudy,Partly cloudy throughout the day.,partly-cloudy-day,"48647099999,48650099999,WMSA,WMKK"
kuala lumpur,12/21/2019,32.9,24,28.2,39.1,24,31.6,24.3,80.9,0,0,0,,,,,10.7,294,1009.8,37.2,9.3,237.2,20.5,9,,2019-12-21T07:12:51,2019-12-21T19:09:12,0.82,Partially cloudy,Partly cloudy throughout the day.,partly-cloudy-day,"48647099999,48650099999,WMSA,WMKK"
kuala lumpur,12/22/2019,32,25.1,27.7,38.7,25.1,30.3,24.8,84.8,6.539,100,8.33,rain,,,,16.6,287.9,1010.7,37.2,9.2,205.2,17.9,8,,2019-12-22T07:13:21,2019-12-22T19:09:42,0.86,"Rain, Partially cloudy",Partly cloudy throughout the day with rain.,rain,"48647099999,48650099999,WMSA,WMKK"
